ID	TOPIC_ID	USER_ID	SUMMARY_NR	SUMMARY_TEXT
11	5	11	1	Quereinsteiger/Seiteneinsteiger in die Lehre\n\n\nAufgrund der besonderen Bedarfs- und Bewerberlage für einige Unterrichtsfächer, berufliche und sonderpädagogische Fachrichtungen steht der Weg in den niedersächsischen Schuldienst nicht nur Lehrkräften mit einer grundständigen für die Unterrichtstätigkeit an Schulen in Niedersachsen vorgesehenen Lehramtsausbildung offen, sondern auch Bewerberinnen und Bewerbern, die ein anderes Hochschulstudium als ein Lehramtsstudium erfolgreich abgeschlossen haben oder über eine in Niedersachsen nicht als gleichwertig anerkannte Lehramtsausbildung verfügen.\nDie Qualifizierungsmaßnahme für Wege in den Schuldienst als Seiteneinstieg Für Absolventinnen und Absolventen von Universitäten und gleichgestellten Hochschulen erfolgt in einem auf zwei Jahre befristeten Beschäftigungsverhältnis berufsbegleitend in der Regel in zwei Unterrichtsfächern.\nDer Gesetzgeber hat mit dem Lehrerausbildungsgesetz vom 12. Mai 2009 (§ 13) die Eckpunkte einer berufsbegleitenden Ausbildung für Seiteneinsteigerinnen und Seiteneinsteiger festgelegt.\nWenn Bewerberinnen und Bewerber das Ziel haben, im Rahmen einer Beschäftigung im Schuldienst die zweijährige berufsbegleitende Ausbildung nach der Ordnung zur berufsbegleitenden Ausbildung von Seiteneinsteigerinnen und Seiteneinsteigern und der Staatsprüfung (OBAS) zu absolvieren, müssen sie sich zunächst auf die Stellenausschreibung einer Schule bewerben, die mit dem Zusatz "Bewerbung von Seiteneinsteigerinnen und Seiteneinsteigern ohne Lehramtsbefähigung" oder vergleichbaren Zusätzen die Bewerbungsmöglichkeit für Seiteneinsteigerinnen und Seiteneinsteiger eröffnet.\nWenn Sie die Voraussetzungen für einen Quereinstieg nicht erfüllen, haben Sie die Möglichkeit, Studien- und Prüfungsleistungen eines vorangegangenen Studiums auf ein Lehramtsstudium anrechnen zu lassen.\nDie Möglichkeit für einen Quereinstieg in den pädagogischen Vorbereitungsdienst existiert bereits seit mehreren Jahren und ist in Teilbereichen dieser Lehrämter möglich.\nIm Rahmen der Qualifizierungsmaßnahme für Wege in den Schuldienst über den Seiteneinstieg für Absolventinnen und Absolventen von Universitäten und gleichgestellten Hochschulen sind von den Seiteneinsteigerinnen und Seiteneinsteigern im ersten Jahr 15 Stunden und im zweiten Jahr 16 Stunden eigenverantwortlicher Unterricht zu erteilen.\nGrundsätzlich wird vor der Bewerbung für eine dieser Maßnahmen dringend empfohlen, sich über die Anforderungen des Lehrkräfteberufs z.B. auf der deutschen Seite des Programms "Career Counselling for Teachers" (CCT) zu informieren und Ihre persönliche Eignung als Lehrerin oder Lehrer festzustellen.\nUnter bestimmten Voraussetzungen kann ein fachlich passender universitärer Studienabschluss einer ersten Staatsprüfung für ein Lehramt gleichgestellt werden und die Bewerberin bzw. der Bewerber direkt in das Referendariat eintreten. \nIm Rahmen der Einstellung in den Schuldienst ist festzustellen, ob ein Einsatz in zwei Fächern und eine erfolgreiche Teilnahme an der berufsbegleitenden Ausbildung in zwei Fächern erwartet werden kann.\nDurch das erfolgreiche Ablegen der Staatsprüfung am Ende des Vorbereitungsdienstes wird die Lehrbefähigung erworben.\nEin Seiteneinstieg in den Lehrerberuf ist nur möglich, wenn Laufbahnbewerberinnen oder Laufbahnbewerber nicht zur Verfügung stehen.\nBei dauerhafter Übernahme in den Schuldienst erfolgt eine Eingruppierung in die Entgeltgruppe, nach der auch voll ausgebildete Lehrkräfte vergütet werden.
16	6	8	1	Reform des Dualen Systems\n\nFür junge Auszubildende kommt es darauf an, eine gute Berufsausbildung zu bekommen. Das zum 1. April 2005 in Kraft getretene Berufsbildungsreformgesetz zielt in diesem Zusammenhang darauf ab, die Ausbildungschancen zu sichern und zu verbessern - unabhängig von der sozialen oder regionalen Herkunft der Auszubildenden.Ziel der Reform ist die Sicherung und Verbesserung der Ausbildungschancen der Jugend sowie einer hohen Qualität der beruflichen Ausbildung.\n\nDas Bundesministerium für Bildung und Forschung (BMBF) fördert neue Projekte, um das System der dualen Berufsausbildung zu stärken. Laut Bundesbildungsministerin Johanna Wanka müssten insbesondere kleine und mittelgroße Unternehmen (KMU) unterstützt werden, damit sie weiterhin einen bedeutsamen Beitrag zur dualen Berufsausbildung leisten können.Wanka möchte die duale Berufsausbildung zukunftssicher und attraktiver machen.\n\nDas neue Berufsbildungsgesetz eröffnet den Ländern die Möglichkeit, dass schulische Berufsausbildungszeiten in anerkannten Ausbildungsberufen genauso zählen wie betriebliche Ausbildungszeiten.Zudem wird im neuen Berufsbildungsgesetz die Fortsetzung zweijähriger Berufsausbildungen in anspruchsvolleren Ausbildungsberufen ohne Zeitverlust erleichtert.Nach der Reform des BBiG können die schulischen Curricula  darüber hinaus so verändert werden, dass die Absolventen die Kammerprüfungen bestehen. Eingeführt wurde zusätzlich, dass der Abschluss von Berufsbildungsgängen mit weiterführenden Schulabschlüssen verknüpft werden kann. Zusätzlich werden Ausbildungsabschnitte im Ausland zu einem gleichwertigen Teil einer anerkannten Berufsausbildung im dualen System.
34	6	9	1	Reform des Dualen Systems\n\n=Einleitung=\nVom "Automatenfachmann" bis zum "Werksteinhersteller" - mit 17 modernisierten dualen Ausbildungsberufen beginnt am 1. August das neue Ausbildungsjahr.\nDas zum 1. April 2005 in Kraft getretene Berufsbildungsreformgesetz zielt darauf ab, die Ausbildungschancen zu sichern und zu verbessern und eine hohe Qualität der beruflichen Ausbildung für alle jungen Menschen zu gewährleisten - unabhängig von ihrer sozialen oder regionalen Herkunft.\n\nDas Verhältnis von Hochschule und Berufsbildung hat sich verändert.\nErstmalig im Jahr 2014 entschieden sich mehr junge Menschen für ein Studium als für eine Berufsausbildung.\n\n=Was ändert sich?=\nIn den Jahren 2005 bis 2009 sowie 2011 bis 2014 wurden unter dem Akronym ANKOM auf der Grundlage von zwei Förderlinien insgesamt 31 Entwicklungsprojekte vom Bundesministerium für Bildung und Forschung (BMBF) mit dem Ziel gefördert, die Durchlässigkeit zwischen der beruflichen und hochschulischen Bildung zu analysieren und zu erhöhen.\nAllerdings fehlen eindeutige Kriterien, anhand derer sich diese Dualität beschreiben lässt.\nDas Bundesministerium für Bildung und Forschung (BMBF) fördert neue Projekte, um das System der dualen Berufsausbildung zu stärken.\nZiel der Förderung im Rahmen des Programms JOBSTARTER plus ist es, regionale Ausbildungsstrukturen und den Übergang von der Schule in die Ausbildung zu verbessern. \nZudem öffnen sich die Hochschulen für neue Zielgruppen.\nZiel der Reform ist die Sicherung und Verbesserung der Ausbildungschancen der Jugend sowie einer hohen Qualität der beruflichen Ausbildung für alle jungen Menschen - unabhängig von ihrer sozialen oder regionalen Herkunft.\nSeit 2000 wurden rund 206 modernisierte und 51 neue Berufe in Kraft gesetzt. \nDie hohe Zahl modernisierter Berufe zeige, wie dynamisch und flexibel das duale Ausbildungssystem sei, so BIBB-Präsident Esser.\nEingeführt wurde zusätzlich, dass der Abschluss von Berufsbildungsgängen mit weiterführenden Schulabschlüssen verknüpft werden kann.\nVorschläge für modernisierte und neue Berufe für qualifizierte Fachkräfte, die zusätzliche Ausbildungsmöglichkeiten erschließen und gute Beschäftigungsperspektiven eröffnen, werden in der Regel innerhalb eines Jahres umgesetzt.\nDas neue Berufsbildungsgesetz unterstützt die rasche Modernisierung durch Verringerung der gesetzlichen Beratungsgremien.\n\n=Warum muss sich was ändern?=\nAm Beispiel der IT-Berufe wird deutlich, dass einem steigenden Fachkräftebedarf nicht allein durch mehr hochschulische Bildungsabschlüsse begegnet werden kann, sondern differenzierte Kompetenzprofile erforderlich sind. \nDurch die Kopplung von Kompetenzerwerb in hochschulischen und betriebspraktischen Kontexten soll der Lerntransfer unterstützt und damit ein Vorteil gegenüber rein akademischen oder rein berufspraktischen Ausbildungsformen erreicht werden. \nEin erheblicher Teil dieser Jugendlichen schließt deshalb an die schulische Berufsausbildung noch einmal eine duale Berufsausbildung an. \nDie Lebenszeit der Jugendlichen, Ressourcen und Fähigkeiten werden auf diese Weise vergeudet.\n\n=Wer profitiert davon?=\nDas Aufstiegsstipendium des BMBF hat unter den Studienförderungen eine besondere Zielgruppe: Es richtet sich an beruflich qualifizierte Fachkräfte und unterstützt ein Hochschulstudium bis zu einem ersten akademischen Abschluss.\nDie Aufstiegsstipendien des Bundesministeriums für Bildung und Forschung richten sich an besonders motivierte Berufstätige, die sich mit einem Hochschulstudium beruflich und persönlich weiterentwickeln möchten.\nMit dem Aufstiegsstipendium wird ein Erststudium in Vollzeit oder berufsbegleitend an einer staatlichen oder staatlich anerkannten Hochschule gefördert.\nAltbewerber mit absolvierter berufvorbereitender Maßnahme haben oft bessere Chancen auf einen Ausbildungsplatz als Schulabgänger\n\nDie Aufstiegsstipendien ergänzen die bestehende Begabtenförderung in der beruflichen Bildung und im Hochschulbereich.\nAuch zwei Jahre nach dem Schulabschluss haben Bewerberinnen und Bewerber gute Chancen auf einen Ausbildungsplatz - insbesondere dann, wenn sie sich in dieser Zeit über eine berufsvorbereitende Maßnahme im Übergangssystem weiterqualifiziert haben. \nDas duale System der beruflichen Bildung bietet allen jungen Menschen die Chance, eine qualifizierte Beschäftigung aufzunehmen und damit ihr Leben selbstverantwortlich zu bestimmen.\nGleichzeitig sichert das System den Fachkräftebedarf der Zukunft und trägt damit entscheidend zur Wettbewerbsfähigkeit und zum Wohlstand Deutschlands bei.\nDie beste Zugangsmöglichkeit zum Arbeitsmarkt bietet auch heute ein Kammerabschlusszeugnis.\nDeswegen sieht das neue Berufsbildungsrecht durch eine entsprechende Ermächtigung der Landesregierungen vor, dass Schülerinnen und Schüler einen erleichterten Zugang zur Kammerprüfung erhalten.\n Nach der Reform des BBiG können und sollten die schulischen Curricula so verändert werden, dass die Absolventen die Kammerprüfungen bestehen und damit die neu eröffneten Möglichkeiten auch nutzen können.\nFachkräfte, die sich fortbilden und einen staatlich anerkannten Abschluss machen, steigen öfter auf der Karriereleiter nach oben.\nDas Aufstiegsstipendium ist das einzige akademische Begabtenförderungsprogramm für Menschen mit Berufserfahrung.\nMeister und Techniker erwerben mit der Aufstiegsfortbildung zudem die Berechtigung, an jeder Hochschule das Fach ihrer Wahl zu studieren.\n\n=Einordnung in den europäischen Kontext=\nMit dem DQR wird auf nationaler Ebene eine Empfehlung des Europäischen Parlaments und des Rates vom April 2008 zur Einrichtung eines Europäischen Qualifikationsrahmens (EQR) für lebenslanges Lernen umgesetzt.\nDer Deutscher Qualifikationsrahmen (DQR) macht Ausbildungsinhalte in Deutschland transparent.\nEr ist an den Europäischen Qualifikationsrahmen (EQR) gekoppelt.\nDie duale Berufsausbildung in Deutschland wird so im gesamten Anwendungsgebiet des EQR vergleichbar.
30	6	10	1	Reform des Dualen Systems\n\n=Einleitung=\n\nDie "anerkannten Ausbildungsberufe" bilden die Grundlage für die Berufsausbildung im Dualen System.\nDie meisten Betriebe, die Jugendliche ausbilden, tragen zunächst Kosten und sehen die Ausbildung vor allem als Investition in die Qualifizierung zukünftiger Fachkräfte.\nIm Jahr 2014 entschieden sich erstmalig mehr Schulabsolventinnen und -absolventen für ein Studium als für eine Berufsausbildung.\n\n=Fachkräftebedarf=\n\nDie Analysen zeigen, dass im Zusammenspiel mit der regionalen Bevölkerungsentwicklung und der dortigen Wirtschaftsstruktur die Arbeitsmarktsituation von hohen Arbeitskräfteengpässen bis zu hohen Überhängen an Arbeitskräften reichen kann.\nMit der zunehmenden Anzahl unbesetzter Ausbildungsplätze hat sich die Forderung nach mehr Durchlässigkeit im Bildungssystem auf die Frage ausgeweitet, wie sich Studienaussteiger/-innen für eine duale Ausbildung gewinnen lassen.\nArbeitskräfte-Engpässe werden vor allem im Bereich der mittleren Ausbildungsabschlüsse auftreten.\nAm Beispiel der IT-Berufe wird deutlich, dass einem steigenden Fachkräftebedarf nicht allein durch mehr hochschulische Bildungsabschlüsse begegnet werden kann.\nGefragt sind zusätzliche Optionen, die Elemente akademischer und beruflicher Bildung integrieren und dabei reziproke Übergänge zwischen den Bildungsbereichen ermöglichen.\nAllerdings fehlen eindeutige Kriterien, anhand derer sich die Dualität von Kompetenzerwerb in hochschulischen und betriebspraktischen Kontexten beschreiben lässt.\nDurch die neuen Kombinationen von Betrieb und beruflicher Schule mit den Schulen als Träger kann\nein regionaler Mangel an betrieblichen Ausbildungsplätzen ausgeglichen werden,\nBetrieben, die bisher nicht ausbilden, der Einstieg in die Berufsausbildung erleichtert werden,\nneuer Qualifizierungsbedarf, zum Beispiel in neu entstehenden Branchen und für neue Berufstätigkeiten, auch dann gedeckt werden, wenn die betrieblichen Ausbildungskapazitäten noch nicht ausreichen und\nauf den in vielen Ausbildungsberufen steigenden Theorieanteil angemessener reagiert werden.\n\n=neues Berufsbildungsgesetz=\nDas neue Berufsbildungsgesetz trägt dazu bei, starre Grenzen zwischen den Bildungsbereichen aufzuheben.\nEin Teil der Jugendlichen nimmt nach der Schule eine der Maßnahmen der Bundesagentur für Arbeit oder aus anderen Sonderprogrammen wahr.\nMit dem neuen Berufsbildungsrecht vom 1. April 2005 wird die Anrechnung der in solchen Maßnahmen erworbenen Qualifikationen auf eine sich anschließende Ausbildungszeit erleichtert.\nZusatzqualifikationen werden als eigenständige, gesondert zu prüfende und zu zertifizierende Qualifikationen eingeführt. Dadurch wird es auch möglich, Teile einer Aufstiegsfortbildung bereits während der Erstausbildung zu absolvieren.\nUm Innovations- und Wettbewerbsfähigkeit der Wirtschaft mit gut ausgebildeten Nachwuchskräften zu sichern, werden den Verantwortlichen im Bund, in den Ländern und in den Regionen mehr Handlungsspielräume gegeben.\nDas mit dem Berufsbildungsreformgesetz im Jahr 2005 vollständig novellierte Berufsbildungsgesetz (BBiG) schafft den rechtlichen Rahmen, damit das System der beruflichen Bildung auch in Zukunft seinen Beitrag zum nachhaltigen Wandel der Arbeitswelten wie auch der Gesellschaft insgesamt leisten kann und zielt darauf ab, die Ausbildungschancen zu sichern und zu verbessern und eine hohe Qualität der beruflichen Ausbildung für alle jungen Menschen zu gewährleisten - unabhängig von ihrer sozialen oder regionalen Herkunft.\n\n\n=neue Ausbildungsordnung=\n\nDie modernisierte Ausbildungsordnung mit 17 modernisierten dualen Ausbildungsberufen tritt am 1. August 2015 in Kraft.\n\n\n\n\n=Aufstiegsstipendium=\n\n\nDas Aufstiegsstipendium wurde vom Bundesministerium für Bildung und Forschung im Jahr 2008 eingeführt und ist das einzige akademische Begabtenförderungsprogramm für Menschen mit Berufserfahrung.\nMit dem Aufstiegsstipendium wird ein Erststudium in Vollzeit oder berufsbegleitend an einer staatlichen oder staatlich anerkannten Hochschule gefördert.\nDie Förderung im erfolgt einkommensunabhängig und für die gesamte Dauer des Studiums.\nFür Studierende im Vollzeitstudium beträgt das Stipendium monatlich 750 Euro.\nZusätzlich zu den 750 Euro wird eine Betreuungspauschale für Kinder gewährt.\nStudierende in einem berufsbegleitenden Studiengang erhalten im Rahmen des Aufstiegsstipendiums jährlich 2.000 Euro.\nDie Aufstiegsstipendien des Bundesministeriums für Bildung und Forschung richten sich an besonders motivierte Berufstätige, die sich mit einem Hochschulstudium beruflich und persönlich weiterentwickeln möchten.\nSie sollen soll es jungen Frauen und Männern, die sich in ihrem Beruf ganz besonders engagieren, finanziell ermöglichen, ein Studium an einer Hochschule zu beginnen.\nFast 7.000 Menschen haben inzwischen ein Aufstiegsstipendium erhalten.
18	7	8	1	Mediation/Streitschlichtung\n\nAn jeder Schule braucht es Menschen, die bereit sind, die Initiative zu ergreifen. Gerade der Lebensraum Schule ist nämlich prädestiniert für das Auftreten von Konflikten. An der Peter-Vischer-Schule ergreifen die ausgebildeten Schüler-Mediatoren aus den 11. Klassen deshalb die Inititative, Mitstreiter zu gewinnen für eine Schulkultur ohne Gewalt.\n\nMediation - was ist das eigentlich? Das Wort Mediation wird heute für ein Verfahren der Konfliktlösung verwendet, das in den 60er und 70er Jahren in den USA entwickelt wurde. Der Mittler zwischen zwei Konfliktparteien wird hierbei Mediator genannt. \n\nDamit es gar nicht erst zu Gewalt kommt, bietet das JRK für Schüler/-innen eine Ausbildung in Streitschlichtung an. Schüler und Schülerinnen lernen dabei, wie man sich in Konfliktsituationen richtig verhält. Da sich das Verfahren bewährt hat, wurden schon mehrfach Schülerinnen und Schüler in Intensivkursen zu Peer-Mediatoren (Schüler-Mediatoren) ausgebildet. \n\nDie Mediatoren haben seit Dezember 1999 schon in vielen Fällen vermittelt. Sie haben gelernt, wie man durch gezielte Fragen, intensives Zuhören und Widerspiegeln/Wiederholen der wichtigen Details eines Konfliktes den Konfliktparteien hilft, für ihre Streitigkeiten selbst einen Lösungsweg zu finden.\n\nDas Schlichtergespräch verläuft im Prinzip in 4 Phasen. Zunächst erzählt man seinen Ärger. Dann informieren die Mediatoren den Konfliktpartner und bitten um ein Gespäch. Die beiden Streitparteien erzählen im Anschluss nacheinander ihre Sicht der Dinge. Im offenen Austausch werden dabei gegenseitige Vorbehalte, Ängste, eigene Bedürfnisse und Vorstellungen genannt. In einer gemeinsamen Vereinbarung wird schließlich festgehalten, was jeder für den anderen innerhalb eines festgelegten Zeitraumes tun wird. Meistens reicht eine Stunde nicht aus, um einen Konflikt zu lösen, und man muss einen weiteren Termin vereinbaren.
19	7	9	1	Mediation/Streitschlichtung\n\n=Einleitung=\nKonflikte sind ein normaler Bestandteil des menschlichen Zusammenlebens.\nGerade der Lebensraum Schule ist prädestiniert für das Auftreten von Konflikten, da immer wieder unterschiedliche Standpunkte und Handlungswünsche kollidieren.\n\n=Was ist Mediation?=\nDas Wort Mediation kommt aus dem lateinischen und bedeutet Vermittlung und wird heute für ein Verfahren der Konfliktlösung verwendet, das in den 60er und 70er Jahren in den USA entwickelt wurde.\nDer Mittler zwischen zwei Konfliktparteien wird Mediator genannt.\nDer Mediator ist der unparteiische Dritte und hilft den Streitenden, eine einvernehmliche Lösung ihrer Probleme zu finden - mit Worten und nicht mit Fäusten.\nDa es sich einfacher auf Augenhöhe reden  lässt, sind die Streitschlichter Schüler, die anderen Schülern in brenzligen Situationen helfen.\nStreitschlichter laden die beiden streitenden Parteien zu einem Schlichtungsgespräch ein. \nZu Beginn eines Streitschlichtungsgesprächs werden die Regeln der Streitschlichtung klar gemacht. \nDas Ziel der Streitschlichtung heißt: Gemeinsam eine Lösung finden.\nUm  zu gewährleisten, dass eine Lösung gefunden wird, sind die Streitschlichter/-innen neutral.\nEs geht darum, wie man durch gezielte Fragen, intensives Zuhören und Widerspiegeln/Wiederholen der wichtigen Details eines Konfliktes den Konfliktparteien hilft, Verständnis füreinander zu haben und wie man sie befähigt für ihre Streitigkeiten selbst einen Lösungsweg zu finden.\nSchülerinnen und Schüler können verschiedene Konfliktlösungsmöglichkeiten auf ihren Erfolg hin bewerten und lernen das Streitschlichterverfahren als Möglichkeit der Konfliktlösung kennen.\nDa sich das Verfahren, dass ausgebildete Pädagogen mit Konflikten umgehen, bewährt hat, wurden schon mehrfach Schülerinnen und Schüler in Intensivkursen von Lehrern und Trainern zu Peer-Mediatoren (Schüler-Mediatoren) ausgebildet.\n\n=Warum ist Mediation außerdem wichtig?=\nVor allem die Vernetzung durch elektronische Medien ist so dicht und global zugänglich geworden, dass für die Schule eine Beschäftigung mit der nicht virtuellen Kommunikation und dem persönlichen Umgang miteinander dringend geboten scheint.\nDie Vermittlung emotionaler und sozialer Kompetenzen wird für Schülerinnen und Schülern immer wichtiger:\nDie Möglichkeit der konstruktiven Konfliktlösung eines Streitschlichter- oder Mediatorenprogramms fördert die Sozialkompetenz von Schülerinnen und Schülern.\nNachweislich hat die Konfliktlösung durch Mediatoren auch eine positive Auswirkung auf das gesamte Schulklima. \n\n=Projekte verschiedener Schulen zur Mediation=\nEs ergreifen die ausgebildeten Schüler-Mediatoren der Peter-Vischer-Schule aus den 11. Klassen diese Initiative und geben ihr Wissen und ihre eigene Erfahrung als Schüler in drei Workshops an die Lehrer weiter. \nWährend sich das Wahlfach für Mediation mit den Grundlagen der Mediation und kleineren Fällen beschäftigte, beschäftigte sich das Profilfach für Mediation intensiv im ersten Halbjahr mit der richtigen Gesprächsführung und der Transaktionsanalyse.\nIm zweiten Halbjahr setzten die Schüler der 11. Klasse der Peter-Vischer-Schule den Schwerpunkt aus aktuellem Anlass auf das Thema Cybermobbing.\nBereits seit einigen Jahren wird von dafür ausgebildeten Pädagogen diese Art mit Konflikten umzugehen, an der Kopernikus-Oberschule angewandt.\nDie Mediatoren der Kopernikus-Oberschule lösen die Konflikte nicht für andere, sagen nicht, was richtig und was falsch ist, sondern die Mediatoren der Kopernikus-Oberschule bleiben unparteiisch und so finden die Konfliktpartner ihre eigene Lösung, die erfolgsversprechender ist als die Lösungsvorschläge von anderen. \nSchüler, die bei der JRK Streitschlichtung lernen, wie man sich in Konfliktsituationen richtig verhält, sorgen dafür, dass es gar nicht erst zu Gewalt kommt und suchen gemeinsam mit den Streitenden nach Lösungen.
