ID	TOPIC_ID	USER_ID	SUMMARY_NR	SUMMARY_TEXT
5	2	8	1	Gewaltprävention\n\n\nGewaltbereitschaft ist zu einem großen Problem unserer Gesellschaft geworden.\nBesonders Schulen spüren diese Erschütterung des Friedens. Es kommt unter Schülerinnen und Schülern nämlich oftmals zu Konflikten.Deshalb müssen Schülerinnen und Schüler für das Thema Gewalt sensibilisiert werden.\n\nImmer weniger Kinder und Jugendliche sind in der Lage, Konflikte gewaltfrei auszutragen. Gewaltbereitschaft entsteht auf dem Boden von übermäßiger Frustration.Der Medienpsychologe der Universität Utrecht Jo Groebel führte aus, dass nicht zuletzt das Fernsehen zu „ einer weltweiten Kultur der Gewalt beiträgt.Wie können aber Gewalttaten und Übergriffe verhindert oder beendet werden? Manchmal fehlt einfach das Wissen, wie sinnvoll geholfen werden kann. Der Bundesdelegiertentag beschließt  aus diesem Grund einen Maßnahmenkatalog zur Verankerung des Themas Gewaltprävention zu erstellen.Es existieren nun gezielte Trainingsprogramme.Viele präventive Maßnahmen werden bereits heute an Schulen durchgeführt. Ein Trainingsprogramm umfasst lediglich circa 6 Schulstunden.Es lohnt sich, Elemente eines solchen Programms zum Inhalt von Unterricht zu machen. Die dargestellten Möglichkeiten zeigen, dass man Gewalt durchaus nicht hilflos gegenüberstehen muss.Aktives gewaltfreies Verhalten ist nämlich erlernbar. \n\nGewalttätigkeit soll vorgebeugt werden, indem man z. B. das Klassenklima verbessert oder die Kommunikationsfähigkeit von Schülern und Lehrkräften trainiert.Auch das Erstellen von Klassenregeln ist bei Auftreten von gewalttätigen Verhalten sehr wichtig, denn das Fehlen von Regeln begünstigt die Entstehung von Gewalt.In diesem Zusammenhang sollten auch Klassengespräche regelmäßig stattfinden.\n\nWichtig ist z.B auch, dass Schülerinnen und Schüler unterschiedliche Formen und Dimensionen von Zivilcourage kennen lernen.Laut des Erziehungswissenschaftlers Dieter Lenzen heißt "Zivilcourage, einem Unrecht nicht tatenlos zuschauen, welches andere Dritten zufügen. Neben persönlichem Mut gehört zur Zivilcourage der Einsatz für Humanität und Demokratie. Man zeigt, dass man bereit ist, gemäß seinen Möglichkeiten einzugreifen. Ein entsprechendes Verhaltenstraining bietet die Chance, ein bisher ungewohntes Verhalten einzuüben und zu reflektieren.
6	2	10	1	Gewaltprävention\n\n=Einleitung=\nGewalt hat viele Gesichter.\nDoch mit Gewalt löst man keine Probleme.\nAn vielen Arbeitsplätzen sind Übergriffe und Drohungen bis hin zur körperlichen und sogar Waffengewalt eine reale Gefahr.\nAggressives Verhalten ist auch in der Schule allgegenwärtig.\nGewalt in der Schule, die von den Medien gerne auf das Versagen der Lehrerschaft zurückgeführt wird, ist nach Meinung des Bildungsforschers Klaus Hurrelmann "Teil der sozialen Krankheit unserer Gesellschaft".\n\n=Ursachen=\nGewaltbereitschaft entsteht auf dem Boden von übermäßiger Frustration und einem Ohnmachtsgefühl.\nJede Konfliktsituation ist von konkreten und situativen Faktoren geprägt.\nGrundsätzlich lässt sich feststellen, dass multifaktorielle Ursachen zur Entstehung von Gewalt beitragen.\nImmer weniger Kinder und Jugendliche sind in der Lage, Konflikte gewaltfrei auszutragen.\nDas Fehlen von Regeln begünstigt die Entstehung von Gewalt.\nSchon bestehende Regeln werden allerdings oft als aufgezwungen empfunden.\nSind die Regeln nicht mehr nur auferlegt, werden sie durch die Unterschrift verbindlicher erlebt und besser mitgetragen.\nDie Schülerinnen können an der Festlegung von Sozialnormen beteiligt werden.\nDer kleinste Teil der Gewalt an Schulen ist "hausgemacht" und deswegen müssen sich Erfolg versprechende Präventivmaßnahmen auch auf den außerschulischen Bereich, etwa im Rahmen von Projektwochen erstrecken.\nDabei sind Konflikte grundsätzlich nichts Negatives, schließlich sind sie Anlass und Möglichkeit, andere Meinungen wahrzunehmen, Anschauungen zu überdenken und das eigene Tun zu verändern.\n\n\n=Maßnahmen=\nLaut Heller und Ziegler nimmt im schulischen Rahmen in der Gewaltprävention die Bedeutung des proaktiven Klassenmanagements zu.\nMittlerweile existieren gezielte Trainingsprogramme, mit denen solche Situationen, vor allem in den Klassen neun bis zehn, bewältigt werden können. \nZur Zeit sind viele Schulen dabei, über gezielte Trainingsprogramme Schülerinnen und Schüler, insbesondere der Klassen neun und zehn, zu befähigen, Streitigkeiten unter sich selbstverantwortlich zu regeln. \nWeil Streitschlichten gelernt sein will, steht für die Vermittler, die Mediatoren, am Anfang das Training Aktives Zuhören, sicheres Auftreten, Gerechtigkeitssinn, Erkennen von Stimmungen, Eingehen auf Gefühle der Streithähne und Gesprächsführung.\nWill man ein Gewaltpräventions-Programm in einer Schule fest implantieren, so bedarf es eines gezielten einführenden Trainings für die Mediatoren und einer begleitenden Betreuung durch einen Lehrer oder Sozialarbeiter.\nAber das Gewaltpräventions-Programm strahlt vieles aus: Engagement und Zivilcourage "machen Schule" und das Verhältnis Schüler-Lehrer entwickelt sich. \nFür die Sekundarstufe I (zehn- bis 16-Jährige) ist es sicherlich günstig mit einem Fallbeispiel zu beginnen.\nInzwischen existieren bereits eine Reihe von Maßnahmen, die sich anbieten, sowohl präventiv als auch im nachhinein mit Konfliktsituationen umzugehen.\nNolting und Paulus schlagen als Vorgehensweise bei aggressiven Handlungen im schulischen Kontext Hemmung eines unerwünschten Verhaltens, Verminderung unerwünschter Anreger, Angebot von positiven Anregern, Veränderung von Einstellungen und Förderung eines alternativen Verhaltens vor.\nGrundsätzlich lassen sich präventive und intervenierende Handlungsmöglichkeiten unterscheiden.\nAußerdem sollen die bereits vorhandenen Methoden der Gesprächsführung erweitert werden und bei der Durchsetzung wichtiger Anliegen Fairness geübt werden.\nDie Gewaltpräventions-Programme sind als schnelle Intervention für akute Konflikte in Schulklassen gedacht.\nEs sollen Störungen, die im Unterricht auftreten, sowie extreme Unterrichtsstile vermindert werden.\nDie Finanzierung des Gewaltpräventionsprogramms muss durch die jeweilige Schule erfolgen.\n\n\n=Mediation=\nBei der Mediation handelt es sich um eine Vermittlung in Konflikten durch unparteiische Dritte.\nIm schulischen Bereich werden zur Gewaltprävention einzelne Schüler zu Konfliktlotsen ausgebildet, man spricht in diesem Falle von einer Peermediation.\nDer Wille zur Mitgestaltung des Lernumfelds ist häufiger anzutreffen, als vermutet.\nDafür werden meist beliebte Schüler wie Schüler- oder Klassensprecher ausgewählt.\nDiese erhalten eine Sprechzeit während einer Unterrichtsstunde und einen eigenen Mediationsraum.\nIn der Pause gibt es bestimmte Plätze, wo man Mediatoren als Ansprechpartner finden kann.\nDer Mediationsprozess lässt sich in drei verschiedene Phasen einteilen.\nIn der Mediations-Vorphase sollen die Konfliktparteien an einen Tisch kommen.\nDas Mediationsgespräch unterteilt sich wiederum in 5 Phasen.\nDie Betroffenen sollen beide als Sieger aus dem Konflikt herausgehen.\nMit der Kampagne "BLEIB' COOL OHNE GEWALT!" wollte das Jugendrotkreuz Kinder und Jugendliche für das Thema Gewalt sensibilisieren, die konstruktive Konfliktfähigkeit von Jugendlichen fördern, Handlungsmöglichkeiten entwickeln, die eine Alternative zu Gewalt darstellen und die Bildung von Netzwerken fördern, die Hilfen für Betroffene anbieten.\nSchüler/-innen können sich im Streitschlichter-Programm des Jugendrotkreuz zu Streitschlichtern ausbilden lassen und vermitteln dann bei Konflikten zwischen Mitschülern.\nDie Übertragung von Verantwortung an SchülerInnen und deren Beteiligung im Sinne der inneren Schulentwicklung ist eine tragende Säule der Gewaltprävention.\nEine verbesserte Kommunikation wird über das Erlernen bestimmter Techniken möglich.\nStichwörter sind hier Mediation, Streitschlichtung (peers) und interkulturelle Sensibilisierung.
64	2	11	1	Gewaltprävention\n\nWenn aus dem gewohnten Alltag heraus das dramatische und erschütternde Ereignis passiert, lassen sich immer wieder folgende, spiralförmig ablaufende Muster der Krisenverarbeitung erkennen.\nKonflikte sind grundsätzlich nichts Negatives, schließlich sind sie Anlass und Möglichkeit, andere Meinungen wahrzunehmen, Anschauungen zu überdenken und das eigene Tun zu verändern.\nJunge Leute, die um die Gefahr wissen und auf etwaige Übergriffe vorbereitet sind, haben bessere Chancen, Gewalttaten vorzubeugen oder sie zu stoppen.\nDas unfassbare Massaker am 26. April 2002 in Erfurt und die Terroranschläge vom 11. Sept. 2001 auf die Vereinigten Staaten von Amerika haben unvorhergesehene Auswirkungen auf die gesamte Welt und bedrohen für alle schmerzlich den Frieden und unsere Zukunft.\nDoch mit Gewalt löst man keine Probleme.\nZur Zeit sind viele Schulen dabei, über gezielte Trainingsprogramme Schülerinnen und Schüler, insbesondere der Klassen neun und zehn, zu befähigen, Streitigkeiten unter sich selbstverantwortlich zu regeln.\nElemente der Streitschlichtung haben sowohl in der Schule als auch in der außerschulischen Jugendarbeit, im Bereich kleinerer Straftaten, der Schiedsgerichtbarkeit und im Berufsleben ihren Platz.\nStreitschlichten will gelernt sein. Bei der Mediation handelt es sich um eine Vermittlung in Konflikten durch unparteiische Dritte.\nEs darf keine Gewinner und Verlierer geben. In Ansätzen wird dabei als Grundregel auch "Körpersprache" mit einbezogen und in Übungshandeln erprobt, wie man auch auf diese Weise locker bleibt oder erfolgreich schlichten kann.\nDer gesamte Rahmen wird nicht von den Regularien und formalisierten Verfahren eines Prozesses, sondern von einer Gesprächssituation geprägt.\nDie Begegnung mit dem Opfer macht dem Täter drastisch klar, was er angerichtet hat.\nKrisen können sich auch aus einer Zuspitzung längerer konflikthafter Prozesse ergeben, brechen aber in ihrer traumatisch-massiven Eindrücklichkeit unerwartet und unvorbereitet auf die Betroffenen herein.\nDie Strafe handeln Täter und Opfer aus; das geht mehr unter die Haut als ein Gerichtsurteil.\nWenn keine Regelung zustande kommt, führt kein Weg an einem gerichtlichen Verfahren vorbei.\nMenschen und auch Institutionen brauchen in Krisensituationen Unterstützung.\nDas wäre ein Grund, das Viergespann der Kardinaltugenden einzuführen und mit Beispielen zu belegen, um zu verdeutlichen, dass Tugenden nicht isoliert, sondern nur im Verbund zur Anwendung kommen können.\nDer Begriff Krisenmanagement bezeichnet das bewusste, aktive sich Kümmern um Menschen und um Einrichtungen und deren Mitglieder\nZivilcourage basiert auf persönlichen Entscheidungen und kann nicht vorgeschrieben werden.\nDer Schwerpunkt liegt auf der Handlungskomponente – womit die Zivilcourage in den Vordergrund rückt – für die allerdings Übungen und Reflexionen unabdingbar und auch Grundkenntnisse und Sensibilisierungen erforderlich sind.\nDie wichtigere Lektion für die Zivilcourage ist das Übungshandeln, um im Ernstfall auf Handlungskategorien und Verhaltensmöglichkeiten zurückgreifen zu können.\nNeben persönlichem Mut gehört zur Zivilcourage der Einsatz für Humanität und Demokratie sowie die Bereitschaft zur friedlichen Konfliktaustragung.\nOft sind es leider die Eltern, die Kindern und Jugendlichen raten, dass es immer besser ist, sich herauszuhalten.\nKinder jedoch, die sich mit der Ideologie ihrer Eltern identifizieren, verarbeiten politische Gewalt besser als andere.\nJe kleiner Kinder sind, desto weniger reagieren sie emotional auf Vorkommnisse, die sie nicht selbst erlebt haben\nAuch Lehrkräfte, die ihre Schüler im Unterricht motivieren können, zeichnen sich durch eine erhöhte Aufmerksamkeit und Präsenz aus.\nErst im Anschluss an eine solche „Selbstklärung“ sollten die mit den Schülern vertrauten Lehrkräfte pädagogisch mit den Klassen arbeiten. \nEs ist daher notwendig, dass sich die Pädagogen selbst, besser noch das Kollegium als Ganzes, mit der eigenen „Befindlichkeit“ bezüglich der miterlebten Katastrophe beschäftigten.\nLehrkräfte, die ihre Schüler im Unterricht motivieren können schaffen es das Interesse der gesamten Klasse auf sich zu konzentrieren und verfügen über ein Bewegungsmanagement, das heißt, Dynamik und nicht Statik beherrschen den Unterrichtsstil.\nSupervision heißt über berufsbezogene Probleme nachzudenken.\nMan unterscheidet zwischen Gruppen- und Einzelsupervision.\nUnter Krise versteht man eine vorübergehende Instabilität eines Individuums oder eines sozialen Systems.\nTypische Symptome sind: Stress, Labilität, Desorganisation, Angst, Lähmung, Chaos, Hilflosigkeit, drohender Kollaps.\nKrise kommt aus dem Griechischem Krisis und bedeutet Entscheidung bzw. entscheidende Wendung.\nDer Leugnungsmechanismus hilft Kinder sich zu distanzieren und somit mit der Situation fertig zu werden.\nKrisenintervention hat weniger therapeutische Ambitionen, sie trachtet also nicht nach einer Modifizierung der Persönlichkeit.\nJede Katastrophe, ob global oder individuell, löst Schock und Versteinerung aus.\nGrundsätzlich lassen sich präventive und intervenierende Handlungsmöglichkeiten unterscheiden.\nzivilgesellschaftlicher Einsatz mit kalkulierbarem Risiko, sollte dabei die Handlungsmaxime sein.\nPrävention gliedert sich in Primär-, Sekundär- und Tertiärprävention.\nKonkret bedeutet Primärprävention hier Friedenserziehung, Erziehung zu Toleranz und Rücksichtnahme, die Stärkung kommunikativer und sozialer Kompetenzen sowie Interesse für die individuellen Bedürfnisse anderer.\nUnter Tertiärprävention versteht man in diesem Zusammenhang Hilfe für die Betroffenen, aus der traumatischen Situation wieder zum Alltag zurückzufinden.\nNach einem bedrohenden oder schockierenden Ereignis müssen jene Menschen besonders betreut werden, bei denen dieser Vorfall akute seelische Belastungen hervorgerufen hat.\nEs bedarf Mitmenschen, die ruhig bleiben und die Übersicht wahren und gleichzeitig fähig sind, die individuellen Bedürfnisse der Betroffenen wahr zu nehmen und gegebenenfalls auch zu erfüllen.\nDie Beispiele von Gewalt an Schulen oder von Schülern sind zahlreich. Pubertäre Rachephantasien als Reaktion auf ständige Demütigungen durch andere Schüler in Verbindung mit waffengeilen Bedürfnissen, neonazistischen Ideen und aufputschender Musik der Neonaziband Ramstein, an deren Texten sie sich berauschten, machten aus Opfern brutale Täter.\nEs wird davon ausgegangen, das Jungen physisch aggressiver sind und Mädchen relational aggressiver.\nLaut Jo Groebel Ein Phänomen liege darin, dass junge Menschen, die Möglichkeit sehen als „Massenmörder berühmt zu werden“\nRough and tumble play sind Raufereien an der Grenze zwischen Spaß und Ernst z. B. am Pausenhof.\nLaut Oswald gelten diese Raufereien jedoch als prosoziales Verhalten, wo nur bestimmte Grenzen ausgetestet werden.\nNach der Shell-Studie Jugend '97 sehen 45,3% der Jugendlichen Arbeitslosigkeit als Hauptproblem.\nDie Häufung von Tätern an Schulformen, die schlechte berufliche Chancen wahrscheinlich machen, bestätigt diese Ergebnisse.\nJo Groebel führte aus, dass das Fernsehen zu „ einer weltweiten Kultur der Gewalt beiträgt".\nJo Groebel meint, Es finde eine Kultivierung von extremster Gewalt statt.\nDas Fehlen von Regeln begünstigt die Entstehung von Gewalt, schon bestehende Regeln werden oft als aufgezwungen empfunden.\nIn der aktuellen Debatte zum Rechtsextremismus taucht auch die Forderung nach Maßnahmen in der Schule auf.\nDamit an Schulen bei Krisenereignissen professionell – pädagogisch gehandelt werden kann, ist es erforderlich, bereits weit im Vorfeld entsprechende Planungen zu treffen, um im Ernstfall nur noch Checklisten abfragen zu müssen, wie man zu handeln hat.
8	3	8	1	Umwelterziehung\n\n\nKlimaschutz ist auch Bildungssache. Deshalb muss Klimaschutz und der bewusste Umgang mit Energie auch in der Schule thematisiert werden.Denn die Nachfrage nach Umweltbildungsmaßnahmen an Deutschlands Schulen ist bei weitem noch nicht erschöpft.\n\nKerstin Küster, Bildungsexpertin bei Greenpeace ist der Meinung, dass wir dringend mehr „Bildung für nachhaltige Entwicklung“ in den Kitas, in den Klassenräumen und Universitäten brauchen. \nUmweltschutz ist nur möglich, wenn bereits im Kindesalter ein Umweltbewusstsein entwickelt wird.Schüler leisten aktiv einen Beitrag zum Klimaschutz, indem sie z.B eine Patenschaft für einen Baum antreten und diesen pflanzen. \n\nEin neuer Leitfaden zeigt außerdem, wie Schulklassen und Umweltgruppen einfach und wirkungsvoll Recyclingpapier-Marktchecks in den Geschäften ihrer Stadt durchführen können. Wer auf Recyclingpapier umstellt, trägt zum Erhalt der Wälder bei.Ein engagiertes Team der Deutschen Umweltstiftung verfolgt in diesem Zusammenhang den Ansatz, die Umwelt durch Vermeidung von Papier als Werbeträger zu schonen.Es wurden neue  Materialien für all diejenigen entwickelt, die zum Thema Recyclingpapier mehr erfahren oder aktiv werden möchten.Im Großen und Ganzen wird dabei aufgezeigt, wie mit einfachen Mitteln ein wichtiger Beitrag zum Umweltschutz geleistet werden kann.
31	3	9	1	Umwelterziehung\n\n=Einleitung=\nDie Energiewende ist eine Jahrhundertaufgabe.\nKlimaschutz ist nicht nur Verhandlungssache - Klimaschutz ist auch Bildungssache!\nLangfristiger Umweltschutz ist…nur möglich, wenn bereits im Kindesalter ein Umweltbewusstsein entwickelt wird.\n\n=Möglichkeiten=\nLehrkräfte können mit…Material die globalen Zusammenhänge der ökologischen Krise verdeutlichen. Sie können Werte der Nachhaltigkeit vermitteln, ihre Schüler zum Nachdenken anregen sowie Möglichkeiten für das eigene Handeln erarbeiten.\nPRONAS vermittelt Ergebnisse der Biodiversitätsforschung an Schülerinnen und Schüler von 12 bis 19 Jahren.\nDas Unternehmen ee entwickelt Grundlagen für das umweltschonende und energieeffiziente Bauen und vermittelt sie in der Ausbildung von Architekten. \nNachhaltigkeit im Bauen ist mehr als ein ethisches Label.\nSchulklassen und Umweltgruppen können einfach und wirkungsvoll Recyclingpapier-Marktchecks in den Geschäften ihrer Stadt durchführen.\nHandel und Hersteller dazu motivieren, ein breiteres Angebot an Recyclingpapier-Produkten zu schaffen.\nWer auf Recyclingpapier umstellt, trägt zum Erhalt der Wälder bei.\n\n=Bildung und Umweltschutz=\nBildung soll für eine nachhaltige Entwicklung“ die Leitperspektive jeglichen Unterrichts werden.\nIn deutschen Bildungsinstitutionen allerdings wurde diese Erkenntnis bisher nur unzureichend verankert.\nEs Kindern ermöglichen, selbst einen Baum zu pflanzen – und dabei mit jeder Menge Spaß viel über Umwelt- und Klimaschutz zu lernen.\nDas „Weltaktionsprogramm für nachhaltige Bildung“ soll auf der nächsten BNE-Weltkonferenz im November in Japan in vollem Umfang beschlossen werden.\nFür das deutsche Bildungssystem drängt das „Bündnis Zukunftsbildung“ auf eine schnelle und engagierte Umsetzung des Programms unter Einbeziehung der Zivilgesellschaft.\nDie Energiewende ist eines der zentralen Reformprojekte Deutschlands.\nIm Mittelpunkt stehen die Förderung von erneuerbaren Energien und die Steigerung der Energieeffizienz.\nDer Klimawandel soll damit eingedämmt und die Green Economy vorangebracht werden.
7	3	10	1	Umwelterziehung\n\n=Einleitung=\nDas Umweltbewusstsein unserer nachfolgenden Generationen bildet den Grundstein für eine nachhaltige und grüne Zukunft.\nWeil langfristiger Umweltschutz in unseren Augen nur möglich ist, wenn bereits im Kindesalter ein Umweltbewusstsein entwickelt wird, möchten die Umweltinitiative "Mach's Grün!" Grundschulen bei der Umweltbildung unterstützen. \n\n=Bildungssystem=\nIn deutschen Bildungsinstitutionen wurde die Erkenntnis, dass Bildung der zentrale Hebel für eine nachhaltige Gesellschaftsentwicklung ist, bisher nur unzureichend verankert.\nDie Nachfrage nach Umweltbildungsmaßnahmen an Deutschlands Schulen ist bei weitem noch nicht erschöpft.\nKlimaschutz und der bewusste Umgang mit Energie sind wichtige Themen in der Schule.\nLaut dem Bündnis ZukunftsBildung fehlt die wirkliche Einbettung in das deutsche Bildungssystem.\nLaut Kerstin Küster, Bildungsexpertin bei Greenpeace, brauchen wir, weil wir der jungen Generation die Möglichkeit geben müssen, nachhaltige Lebensweisen zu verstehen, auszuprobieren und einzuüben,  dringend mehr „Bildung für nachhaltige Entwicklung“ in den Kitas, in den Klassenräumen, Universitäten und auch allen beruflichen Bildungseinrichtungen“.\n\n=Projekte=\nLaut Küster müssen wir, wenn wir wollen, dass die junge Generation eine zukunftsfähige Lebensweise einnimmt, ihnen auch die Möglichkeit geben, diese zu verstehen, auszuprobieren und einzuüben.\nUnter dem Stichwort „Nachhaltigkeit lernen“ wurden in den letzten Jahren in Deutschland viele Projekte zu Themen wie „Umwelt“, „Entwicklung“ oder „Soziales“ auf den Weg gebracht.\nBereits 2002 hatte die Generalversammlung der Vereinten Nationen entschieden, dass „Bildung für eine nachhaltige Entwicklung“ die Leitperspektive jeglichen Unterrichts werden solle und beschloss eine gleichnamige Dekade (2005-2014) einzuberufen.\nLaut dem Bündnis ZukunftsBildung blieben viele Projekte  in ihrer Wirkung begrenzt, weil Bildung für nachhaltige Entwicklung nach wie vor nicht systematisch und flächendeckend in allen Bildungsbereichen verankert wird.
12	4	8	1	Gesunde Ernährung\n\n\nKinder brauchen eine gesunde und ausgewogene Ernährung.\nWer ständig mehr isst, als der Körper verbrennen kann, riskiert Folgekrankheiten. Es ist deshalb wichtig, dass Kinder frühzeitig Gelegenheiten bekommen, ein ausgewogenes Ess- und Trinkverhalten zu erlernen und  aufgeklärt heranwachsen.\n\nStudien zeigen, dass der Fast-Food-Konsum bei Jugendlichen ansteigt.Die Schülerinnen und Schüler der Mittelstufe sind nur selten freiwillig in der Schulmensa anzutreffen.Angesichts der Produktfülle in den Supermärkten ist deshalb die Fähigkeit, Lebensmittel anhand der Pflichtangaben zu bewerten, wichtig.\nSchülerinnen und Schüler sollten lernen, sich mit Angaben auf Lebensmittelverpackungen kritisch auseinanderzusetzen und begreifen, dass eine zu energiereiche Ernährung nicht nur dick, sondern auch krank machen kann.Sie sollten positive und negative Aspekte bestimmter Mahlzeiten reflektieren und Informationen aus Etiketten filtern können.\n\nDie Ganztagsschule bietet in diesem Zusammenhang die Möglichkeit, Kinder mit einer ausgewogenen Mittagsmahlzeit in angenehmer Essatmosphäre zu versorgen.Mit Hilfe von PETAs Unterrichtsprojekt „Veggie-Führerschein“ lernen Schüler und Schülerinnen zudem etwas über Rechte und Pflichten und diskutieren über moralische, soziale, kulturelle und gesundheitliche Aspekte der Ernährung. Ziel ist, dass Schüler und Schülerinnen  eine Lebensmittelauswahl im Alltag treffen, die gesundheits- und bedürfnisorientiert ist.
32	4	9	1	Gesunde Ernährung\n\n=Einleitung=\nFalsche Essgewohnheiten können sich negativ auf das Wohlbefinden, die Konzentrations- und Leistungsfähigkeit auswirken.\n\nGesundes Essen beeinflusst nicht nur die körperliche, sondern auch die mentale Leistungsfähigkeit.\nBesonders Kinder brauchen eine gesunde und ausgewogene Ernährung, um sich optimal entwickeln zu können und um leistungsfähig zu sein.\n\n=Gefahren=\n Zudem hat ein familialer Wandel stattgefunden, der dazu beiträgt, dass traditionelle Versorgungsstrukturen mehr und mehr an Bedeutung verlieren.\nGemeinsame Mahlzeiten im familiären Rahmen finden immer seltener statt.\nStattdessen spielen Begriffe wie Außer-Haus-Verpflegung und besonders Schulverpflegung eine immer größere Rolle im Alltagsleben.\nEinige Lebensmittel und Mahlzeiten können trotz hoher Energiedichte schlecht sättigen.\n\nWer ständig mehr isst, als der Körper verbrennen kann, riskiert nicht nur zunehmende Fettpölsterchen, sondern ernsthafte Folgekrankheiten.\n\n=Möglichkeiten=\nDeshalb sollte man möglichst früh lernen, den eigenen Energiebedarf zu berechnen und im Blick zu behalten.\nAusgewogene Speisen können sehr vielseitig gestaltet und auf individuelle Essgewohnheiten abgestimmt werden.\nZu einer präventiven Gesundheitserziehung gehört eine ausgewogene Ernährung.\n Da Ernährungsgewohnheiten bereits im Kindesalter geprägt werden, ist es wichtig, dass Kinder mit Spaß und Freude Obst kennenlernen und sozusagen auf "seinen Geschmack" kommen.\nHersteller sind gesetzlich verpflichtet, bestimmte Angaben über ihre Produkte zu machen - die so genannten Pflichtangaben auf der Verpackung. Der Gesetzgeber will den Verbrauchern damit die Möglichkeit geben, sich über ein Lebensmittel verlässlich zu informieren.\n\n=Ist-Zustand=\nDieses Angebot ist für den Verbraucher oft schwer zu durchschauen und kann zu Unsicherheit bezüglich der Auswahl und Zubereitung von Lebensmitteln führen.\nUmweltbewusstes Essen ist nicht nur eine Frage natürlicher Produktionsbedingungen und Kontrollmechanismen seitens der Industrie.\nIn den letzten Jahrzehnten hat sich im Zuge von Globalisierung und Technisierung das Lebensmittelangebot von einer saisonabhängigen regionalen Vielfalt dahingehend verändert, dass Lebensmittel aller Art zu jeder Jahreszeit durch Importe aus Übersee verfügbar sind.
