ID	TOPIC_ID	DOC_ID	USER_ID	POSITION_START	POSITION_END	TEXT	SOURCE	LINK_GROUP	COLOR	NUGGET_ID
477	2	12	11	750	1257	Weitere Projekte des gemeinnützigen Vereins Wir stärken Dich, die ebenfalls vorwiegend der schulischen Prävention bzw. der Präventionsarbeit an Kindergärten dienen sollen, sind u.a. die Theatershow "Der neue Schüler" zum Thema Mobbing an Schulen, die Kreativwettbewerbe "Starke Kinder" für Grundschulen und "Schule bewegt sich" für die Sekundarstufen zur Gewalt- und Suchtprävention und der "Wir sind starke Kinder"-Song zum Thema Mut, Fairness und Freundschaft für den Kindergartenbereich und die Vorschule		-1	1	276
719	3	13	8	192	253	Wie wird die Welt in dreißig oder einhundert Jahren aussehen?		-1	1	535
720	3	13	8	532	586	Diese Szenarien beschreiben „mögliche künftige Welten“		-1	1	536
721	3	14	8	572	607	Klimaschutz ist auch Bildungssache!		-1	1	547
722	3	16	8	57	185	haben wir neue Materialien für all diejenigen entwickelt, die zum Thema Recyclingpapier mehr erfahren oder aktiv werden möchten.		-1	1	557
723	3	16	8	402	560	neue Leitfaden zeigt, wie Schulklassen und Umweltgruppen einfach und wirkungsvoll Recyclingpapier-Marktchecks in den Geschäften ihrer Stadt durchführen können		-1	1	558
724	3	16	8	886	968	Wer einen Recyclingpapier-Marktcheck starten will, kann diese Textvorlagen nutzen,		-1	1	559
725	3	16	8	1371	1436	Wer auf Recyclingpapier umstellt, trägt zum Erhalt der Wälder bei		-1	1	560
726	3	16	8	1438	1482	Das schont Ressourcen und ist gut fürs Klima		-1	1	561
727	3	17	8	327	423	gezeigt, wie mit einfachen Mitteln ein wichtiger Beitrag zum Umweltschutz geleistet werden kann.		-1	1	562
728	3	17	8	451	565	 Umweltschutz ist in unseren Augen nur möglich, wenn bereits im Kindesalter ein Umweltbewusstsein entwickelt wird.		-1	1	563
729	3	17	8	914	1006	verfolgen wir den Ansatz, die Umwelt durch Vermeidung von Papier als Werbeträger zu schonen.		-1	1	537
730	3	18	8	444	553	denn die Nachfrage nach Umweltbildungsmaßnahmen an Deutschlands Schulen ist bei weitem noch nicht erschöpft.\n		-1	1	538
733	3	18	8	742	822	Gemeinsam mit euch wollen wir Kindern ermöglichen, selbst einen Baum zu pflanzen		-1	1	539
734	3	18	8	981	1048	Wir sind ein junges, engagiertes Team der Deutschen Umweltstiftung,		-1	1	540
735	3	18	8	1181	1263	bekommt jedes Kind einen eigenen heimischen Setzling, den es selbst pflanzen darf,		-1	1	541
736	3	18	8	1589	1671	wollen wir diesen Kindern die Chance geben, einen Baum an ihrer Schule zu pflanzen		-1	1	542
737	3	18	8	2447	2498	Schüler leisten aktiv einen Beitrag zum Klimaschutz		-1	1	543
738	3	18	8	2652	2705	Die Schüler treten eine Patenschaft für ihren Baum an		-1	1	544
739	3	18	8	4294	4365	Gemeinsam erarbeiten sich die Schüler Wissen zum Thema Umwelt und Natur		-1	1	545
740	3	18	8	4541	4597	Wir stellen Unterrichts- und Informationsmaterial bereit		-1	1	546
741	3	19	8	224	225	 		-1	1	548
742	3	19	8	0	68	Die Energiewende ist eines der zentralen Reformprojekte Deutschlands		-1	1	549
743	3	19	8	377	452	Die Abkehr von fossilen Brennstoffen wie Öl, Kohle und Gas ist unumgänglich		-1	1	550
744	3	19	8	542	568	Erneuerbare Energiequellen		1	1	533
745	3	19	8	618	644	müssen erschlossen werden.		1	1	533
746	3	20	8	22	99	Wir entwickeln Grundlagen für das umweltschonende und energieeffiziente Bauen		-1	1	551
747	3	20	8	661	733	Wir verstehen unsere Arbeit als eine Querschnittsaufgabe der Architektur		-1	1	552
748	3	20	8	798	917	Unser Ziel ist, die Leistung von Gebäuden, die sie für ihre Nutzer und ihre Umgebung erbringen, deutlich zu verbessern 		-1	1	553
749	3	20	8	1161	1209	 Denn die verfügbaren Mittel für Umweltschonung 		2	1	534
750	3	20	8	1230	1293	sind zugleich die wesentlichen Ausdruckselemente der Architektu		2	1	534
751	3	21	8	0	82	Klimaschutz und der bewusste Umgang mit Energie sind wichtige Themen in der Schule		-1	1	554
752	3	22	8	670	729	Bildung ist der Schlüssel für eine nachhaltige Entwicklung.		-1	1	555
753	3	22	8	910	1033	Deswegen brauchen wir dringend mehr „Bildung für nachhaltige Entwicklung“ in den Kitas, in den Klassenräumen, Universitäten	Kerstin Küster, Bildungsexpertin bei Greenpeace.	-1	1	556
754	3	13	9	774	880	PRONAS vermittelt Ergebnisse der Biodiversitätsforschung an Schülerinnen und Schüler von 12 bis 19 Jahren.		-1	1	566
755	3	14	9	282	303	Lehrkräfte können mit		1	1	564
756	3	14	9	308	520	Material die globalen Zusammenhänge der ökologischen Krise verdeutlichen. Sie können Werte der Nachhaltigkeit vermitteln, ihre Schüler zum Nachdenken anregen sowie Möglichkeiten für das eigene Handeln erarbeiten.		1	1	564
757	3	14	9	526	607	Klimaschutz ist nicht nur Verhandlungssache - Klimaschutz ist auch Bildungssache!		-1	1	567
758	3	16	9	428	560	Schulklassen und Umweltgruppen einfach und wirkungsvoll Recyclingpapier-Marktchecks in den Geschäften ihrer Stadt durchführen können		-1	1	577
759	3	16	9	579	681	Handel und Hersteller dazu motivieren, ein breiteres Angebot an Recyclingpapier-Produkten zu schaffen.		-1	1	578
762	3	16	9	1371	1437	Wer auf Recyclingpapier umstellt, trägt zum Erhalt der Wälder bei.		-1	1	579
764	3	17	9	438	468	Langfristiger Umweltschutz ist		2	1	565
765	3	17	9	486	564	nur möglich, wenn bereits im Kindesalter ein Umweltbewusstsein entwickelt wird		2	1	565
766	3	18	9	761	766	wolle		-1	1	580
767	3	18	9	772	900	Kindern ermöglichen, selbst einen Baum zu pflanzen – und dabei mit jeder Menge Spaß viel über Umwelt- und Klimaschutz zu lernen.		-1	1	581
770	3	19	9	0	69	Die Energiewende ist eines der zentralen Reformprojekte Deutschlands.		-1	1	582
771	3	19	9	70	172	Im Mittelpunkt stehen die Förderung von erneuerbaren Energien und die Steigerung der Energieeffizienz.		-1	1	583
772	3	19	9	173	254	Der Klimawandel soll damit eingedämmt und die Green Economy vorangebracht werden.		-1	1	584
773	3	19	9	331	376	Die Energiewende ist eine Jahrhundertaufgabe.		-1	1	568
774	3	20	9	26	153	entwickeln Grundlagen für das umweltschonende und energieeffiziente Bauen und vermitteln sie in der Ausbildung von Architekten.		-1	1	569
775	3	20	9	154	211	Nachhaltigkeit im Bauen ist mehr als ein ethisches Label,		-1	1	570
776	3	21	9	0	83	Klimaschutz und der bewusste Umgang mit Energie sind wichtige Themen in der Schule.		-1	1	571
778	3	22	9	0	77	Bildung ist der zentrale Hebel für eine nachhaltige Gesellschaftsentwicklung.		-1	1	572
779	3	22	9	78	181	In deutschen Bildungsinstitutionen allerdings wurde diese Erkenntnis bisher nur unzureichend verankert.		-1	1	573
780	3	22	9	1224	1320	Bildung für eine nachhaltige Entwicklung“ die Leitperspektive jeglichen Unterrichts werden solle		-1	1	574
781	3	22	9	2419	2559	das „Weltaktionsprogramm für nachhaltige Bildung“ auf der nächsten BNE-Weltkonferenz im November in Japan in vollem Umfang beschlossen wird.		-1	1	575
782	3	22	9	2561	2728	Für das deutsche Bildungssystem drängt das „Bündnis Zukunftsbildung“ auf eine schnelle und engagierte Umsetzung des Programms unter Einbeziehung der Zivilgesellschaft.		-1	1	576
657	3	17	10	438	565	Langfristiger Umweltschutz ist in unseren Augen nur möglich, wenn bereits im Kindesalter ein Umweltbewusstsein entwickelt wird.		-1	1	518
658	3	17	10	566	633	Daher möchten wir Grundschulen bei der Umweltbildung unterstützen. 		-1	1	519
659	3	18	10	449	552	die Nachfrage nach Umweltbildungsmaßnahmen an Deutschlands Schulen ist bei weitem noch nicht erschöpft.		-1	1	525
660	3	18	10	2327	2445	Das Umweltbewusstsein unserer nachfolgenden Generationen bildet den Grundstein für eine nachhaltige und grüne Zukunft.		-1	1	526
661	3	21	10	0	83	Klimaschutz und der bewusste Umgang mit Energie sind wichtige Themen in der Schule.		-1	1	527
662	3	22	10	0	77	Bildung ist der zentrale Hebel für eine nachhaltige Gesellschaftsentwicklung.		-1	1	528
663	3	22	10	79	181	n deutschen Bildungsinstitutionen allerdings wurde diese Erkenntnis bisher nur unzureichend verankert.		-1	1	529
664	3	22	10	730	909	Wenn wir wollen, dass die junge Generation eine zukunftsfähige Lebensweise einnimmt, müssen wir ihnen auch die Möglichkeit geben, diese zu verstehen, auszuprobieren und einzuüben.	Kerstin Küster, Bildungsexpertin bei Greenpeace	-1	1	530
665	3	22	10	910	1083	Deswegen brauchen wir dringend mehr „Bildung für nachhaltige Entwicklung“ in den Kitas, in den Klassenräumen, Universitäten und auch allen beruflichen Bildungseinrichtungen“	Kerstin Küster, Bildungsexpertin bei Greenpeace	-1	1	531
666	3	22	10	1418	1595	Unter dem Stichwort „Nachhaltigkeit lernen“ wurden in den letzten Jahren in Deutschland viele Projekte zu Themen wie „Umwelt“, „Entwicklung“ oder „Soziales“ auf den Weg gebracht		-1	1	532
667	3	22	10	1597	1716	gleichzeitig wuchs das Bewusstsein, dass nur eine entsprechend gebildete Gesellschaft sich nachhaltig entwickeln kann.\n		-1	1	520
668	3	22	10	1140	1386	Bereits 2002 hatte die Generalversammlung der Vereinten Nationen entschieden, dass „Bildung für eine nachhaltige Entwicklung“ die Leitperspektive jeglichen Unterrichts werden solle und beschloss eine gleichnamige Dekade (2005-2014) einzuberufen.\n		-1	1	521
669	3	22	10	1774	1959	„Viele Projekte blieben in ihrer Wirkung begrenzt, weil Bildung für nachhaltige Entwicklung nach wie vor nicht systematisch und flächendeckend in allen Bildungsbereichen verankert wird“	Bündnis ZukunftsBildung	-1	1	522
670	3	22	10	2158	2228	Was fehlt, ist die wirkliche Einbettung in das deutsche Bildungssystem	Bündnis ZukunftsBildung	-1	1	523
671	3	22	10	2948	3051	nur wer sich heute stark macht für die nachhaltige Bildung kann der Zukunft mit Vertrauen entgegensehen	Kerstin Küster, Bildungsexpertin bei Greenpeace	-1	1	524
2377	3	13	11	59	91	ist das Akronym für PROjektionen	Dr. Karin Ulbrich	-1	1	0
2378	3	13	11	254	292	Werden wir dann noch das Tagpfauenauge		2	1	0
2379	3	13	11	532	579	Diese Szenarien beschreiben „mögliche künftige 		2	1	0
2380	3	13	11	634	659	d ökologischen Dimensione		3	1	0
2381	3	13	11	732	753	 gemeinsam Lernmateri		3	1	0
2382	3	13	11	834	858	Schülerinnen und Schüler		4	1	0
2383	3	13	11	1007	1018	iodiversitä		4	1	0
2384	3	13	11	913	948	von der EU geförderte ALARM-Projekt	Dr. Josef Settele	-1	1	0
879	4	23	8	0	101	Die Schülerinnen und Schüler der Mittelstufe sind nur selten freiwillig in der Schulmensa anzutreffen		-1	1	665
880	4	23	8	107	146	Sie versorgen sich lieber mit Fast Food		-1	1	666
881	4	23	8	182	240	Studien zeigen, dass der Fast-Food-Konsum bei Jugendlichen		1	1	664
882	4	23	8	264	274	 ansteigt.		1	1	664
884	4	23	8	310	401	Die Schülerinnen und Schüler\n\n• reflektieren die Vor- und Nachteile von Fast-Food-Angeboten		-1	1	708
885	4	23	8	944	956	Ziel ist es,		2	1	689
886	4	23	8	991	1029	über Fast Food ins Gespräch zu kommen.		2	1	689
887	4	23	8	1030	1133	Der Fokus liegt dabei vor allem auf dem Umgang mit der Thematik in der Mittagspause und im Schulalltag.		-1	1	717
888	4	24	8	0	48	Immer neue innovative Getränke erobern den Markt		-1	1	718
889	4	24	8	234	316	 Umso wichtiger ist es, dass sich auch die kleinen Konsumenten das Getränkeangebot		3	1	690
890	4	24	8	343	361	genauer anschauen.		3	1	690
891	4	24	8	397	486	Die Schülerinnen und Schüler\n\n• begreifen, dass Getränke sehr unterschiedlich sein können		-1	1	719
892	4	24	8	642	710	Die Schülerinnen und Schüler\n\n• filtern Informationen aus Etiketten\n		-1	1	720
895	4	24	8	1357	1371	Kinder sollten		5	1	691
896	4	24	8	1414	1486	Zucker bereits als ungünstigen Nahrungsbestandteil kennengelernt haben.\n		5	1	691
897	4	25	8	1051	1095	Durch Variationen erweitern die Jugendlichen		6	1	692
898	4	25	8	1106	1127	ihre Küchenkenntnisse		6	1	692
899	4	25	8	1417	1554	Ziel ist, dass sie am Ende der Unterrichtsreihe eine Lebensmittelauswahl im Alltag treffen, die gesundheits- und bedürfnisorientiert ist.		-1	1	721
905	4	26	8	266	360	Die Schülerinnen und Schüler\n\n• lernen die Pflichtangaben der Lebensmittelkennzeichnung kennen		-1	1	722
906	4	26	8	570	684	Die Schülerinnen und Schüler\n\n• lernen sich mit Angaben auf Lebensmittelverpackungen kritisch auseinanderzusetzen\n		-1	1	723
907	4	26	8	1285	1411	Angesichts der Produktfülle in den Supermärkten ist die Fähigkeit, Lebensmittel anhand der Pflichtangaben zu bewerten, wichtig		-1	1	698
908	4	27	8	0	98	Gesundes Essen beeinflusst nicht nur die körperliche, sondern auch die mentale Leistungsfähigkeit.		-1	1	699
909	4	27	8	343	508	Die Schülerinnen und Schüler\n\n• erkennen, dass sich falsche Essgewohnheiten negativ auf das Wohlbefinden, die Konzentrations- und Leistungsfähigkeit auswirken können		-1	1	700
910	4	27	8	2169	2248	Das gemeinsame Essen soll als Orientierungshilfe für gesunde Ernährung dienen.\n		-1	1	701
911	4	28	8	0	76	Zu einer präventiven Gesundheitserziehung gehört eine ausgewogene Ernährung.		-1	1	702
912	4	28	8	288	392	Die Schülerinnen und Schüler\n\n• wissen um die gesundheitsförderliche Wirkung des Apfels als Lebensmittel		-1	1	703
913	4	29	8	390	538	In sechs bis sieben Doppelstunden bereiten die Schülerinnen und Schüler leckere Salate, fruchtige Quarkspeisen und andere kleine, kalte Gerichte zu.		-1	1	704
915	4	29	8	834	914	Beim aid-Ernährungsführerschein dürfen die Kinder vor allem eines: Selbermachen!		-1	1	705
945	4	30	8	0	63	Wer ständig mehr isst, als der Körper verbrennen kann, riskiert		7	1	693
946	4	30	8	121	138	Folgekrankheiten.		7	1	693
947	4	30	8	281	408	Die Schülerinnen und Schüler\n\n• begreifen, dass eine zu energiereiche Ernährung nicht nur dick, sondern auch krank machen kann\n		-1	1	706
948	4	30	8	804	900	Die Schülerinnen und Schüler\n\n• reflektieren positive und negative Aspekte bestimmter Mahlzeiten		-1	1	707
949	4	30	8	3985	4025	Ernährung und Bewegung gehören zusammen\n		-1	1	709
950	4	31	8	0	81	Umweltbewusstes Essen ist nicht nur eine Frage natürlicher Produktionsbedingungen		-1	1	710
951	4	31	8	419	493	Angesichts des aktuellen Pferdefleischskandals möchte Greenpeace den Blick		8	1	694
952	4	31	8	524	594	auf die Hintergründe und Zusammenhänge der Nahrungsproduktion lenken. 		8	1	694
953	4	32	8	170	366	Mit Hilfe von PETAs Unterrichtsprojekt „Veggie-Führerschein“ lernen sie etwas über Rechte und Pflichten, diskutieren über moralische, soziale, kulturelle und gesundheitliche Aspekte der Ernährung 		-1	1	711
954	4	32	8	433	462	Die Schüler sollen aufgeklärt		9	1	695
955	4	32	8	530	544	 heranwachsen.		9	1	695
956	4	33	8	880	944	Besonders Kinder brauchen eine gesunde und ausgewogene Ernährung		-1	1	712
958	4	33	8	1013	1083	 Daher ist es wichtig, dass sie frühzeitig Gelegenheiten bekommen, ein		10	1	696
959	4	33	8	1101	1150	ausgewogenes Ess- und Trinkverhalten zu erlernen.		10	1	696
960	4	33	8	1557	1629	Ganztagsschule bietet die Möglichkeit, die Kinder mit einer ausgewogenen		11	1	697
961	4	33	8	1672	1729	Mittagsmahlzeit in angenehmer Essatmosphäre zu versorgen.		11	1	697
962	4	34	8	1593	1692	Der Aspekt "Kinder und Ernährung" fragt, wie Kinder an die Tätigkeit des Essens herangeführt werden		-1	1	713
963	4	35	8	55	178	Dass ein Frühstück alle drei Kriterien erfüllen kann und trotzdem schnell geht, lernen Kinder in diesem Unterrichtsprojekt.		-1	1	714
964	4	35	8	203	314	Mit einer Fragebogenaktion ermitteln die Kinder die Frühstücksgewohnheiten ihrer Mitschülerinnen und Mitschüler		-1	1	715
965	4	35	8	394	442	Sie lernen, was ein gesundes Frühstück ausmacht,		-1	1	716
919	4	25	9	1148	1261	dass ausgewogene Speisen sehr vielseitig gestaltet und auf individuelle Essgewohnheiten abgestimmt werden können.		-1	1	668
920	4	26	9	1021	1284	Hersteller sind gesetzlich verpflichtet, bestimmte Angaben über ihre Produkte zu machen - die so genannten Pflichtangaben auf der Verpackung. Der Gesetzgeber will den Verbrauchern damit die Möglichkeit geben, sich über ein Lebensmittel verlässlich zu informieren.		-1	1	669
921	4	27	9	0	98	Gesundes Essen beeinflusst nicht nur die körperliche, sondern auch die mentale Leistungsfähigkeit.		-1	1	677
922	4	27	9	99	190	Das richtige Essen zum richtigen Zeitpunkt beugt Müdigkeit und Konzentrationsschwächen vor.		-1	1	678
923	4	27	9	385	509	dass sich falsche Essgewohnheiten negativ auf das Wohlbefinden, die Konzentrations- und Leistungsfähigkeit auswirken können\n		-1	1	679
924	4	28	9	0	76	Zu einer präventiven Gesundheitserziehung gehört eine ausgewogene Ernährung.		-1	1	680
925	4	28	9	76	252	 Da Ernährungsgewohnheiten bereits im Kindesalter geprägt werden, ist es wichtig, dass Kinder mit Spaß und Freude Obst kennenlernen und sozusagen auf "seinen Geschmack" kommen.		-1	1	681
926	4	30	9	0	138	Wer ständig mehr isst, als der Körper verbrennen kann, riskiert nicht nur zunehmende Fettpölsterchen, sondern ernsthafte Folgekrankheiten.		-1	1	682
927	4	30	9	139	245	Deshalb sollte man möglichst früh lernen, den eigenen Energiebedarf zu berechnen und im Blick zu behalten.		-1	1	683
928	4	30	9	324	407	dass eine zu energiereiche Ernährung nicht nur dick, sondern auch krank machen kann		-1	1	684
929	4	30	9	565	644	einige Lebensmittel und Mahlzeiten trotz hoher Energiedichte schlecht sättigen\n		-1	1	670
930	4	31	9	0	128	Umweltbewusstes Essen ist nicht nur eine Frage natürlicher Produktionsbedingungen und Kontrollmechanismen seitens der Industrie.		-1	1	671
931	4	33	9	0	265	In den letzten Jahrzehnten hat sich im Zuge von Globalisierung und Technisierung das Lebensmittelangebot von einer saisonabhängigen regionalen Vielfalt dahingehend verändert, dass Lebensmittel aller Art zu jeder Jahreszeit durch Importe aus Übersee verfügbar sind.\n		-1	1	672
932	4	33	9	266	420	Dieses Angebot ist für den Verbraucher oft schwer zu durchschauen und kann zu Unsicherheit bezüglich der Auswahl und Zubereitung von Lebensmitteln führen.		-1	1	673
933	4	33	9	463	604	 zudem ein familialer Wandel stattgefunden, der dazu beiträgt, dass traditionelle Versorgungsstrukturen mehr und mehr an Bedeutung verlieren.		-1	1	674
934	4	33	9	605	648	Gemeinsame Mahlzeiten im familiären Rahmen,		1	1	667
935	4	33	9	721	749	finden immer seltener statt.		1	1	667
936	4	33	9	750	877	Stattdessen spielen Begriffe wie Außer-Haus-Verpflegung und besonders Schulverpflegung eine immer größere Rolle im Alltagsleben		-1	1	675
937	4	33	9	880	1013	Besonders Kinder brauchen eine gesunde und ausgewogene Ernährung, um sich optimal entwickeln zu können und um leistungsfähig zu sein.		-1	1	676
970	4	23	10	182	274	Studien zeigen, dass der Fast-Food-Konsum bei Jugendlichen - vor allem bei Jungs - ansteigt.		-1	1	727
971	4	24	10	6	48	neue innovative Getränke erobern den Markt		-1	1	728
972	4	24	10	50	79	sie machen "Trinken" zum Kult		-1	1	739
973	4	24	10	128	144	Das Durstlöschen		1	1	724
974	4	24	10	197	233	tritt dabei meist in den Hintergrund		1	1	724
975	4	24	10	235	361	Umso wichtiger ist es, dass sich auch die kleinen Konsumenten das Getränkeangebot in ihren Supermärkten mal genauer anschauen.		-1	1	745
976	4	25	10	1051	1261	Durch Variationen erweitern die Jugendlichen nicht nur ihre Küchenkenntnisse, sie erkennen auch, dass ausgewogene Speisen sehr vielseitig gestaltet und auf individuelle Essgewohnheiten abgestimmt werden können.		-1	1	746
977	4	25	10	1417	1554	Ziel ist, dass sie am Ende der Unterrichtsreihe eine Lebensmittelauswahl im Alltag treffen, die gesundheits- und bedürfnisorientiert ist.		-1	1	747
978	4	25	10	1555	1689	Dazu gehört auch, dass sie ihre eigenen Geschmacksvorlieben kennen (lernen) und Möglichkeiten finden, die Speisen darauf auszurichten.		-1	1	748
979	4	26	10	1285	1489	Angesichts der Produktfülle in den Supermärkten ist die Fähigkeit, Lebensmittel anhand der Pflichtangaben zu bewerten, wichtig und die einzige Möglichkeit für den Verbraucher, Werbeaussagen zu überprüfen.		-1	1	749
980	4	27	10	0	98	Gesundes Essen beeinflusst nicht nur die körperliche, sondern auch die mentale Leistungsfähigkeit.		-1	1	750
981	4	27	10	99	190	Das richtige Essen zum richtigen Zeitpunkt beugt Müdigkeit und Konzentrationsschwächen vor.		-1	1	751
982	4	28	10	0	76	Zu einer präventiven Gesundheitserziehung gehört eine ausgewogene Ernährung.		-1	1	729
983	4	30	10	0	138	Wer ständig mehr isst, als der Körper verbrennen kann, riskiert nicht nur zunehmende Fettpölsterchen, sondern ernsthafte Folgekrankheiten.		-1	1	730
984	4	30	10	139	245	Deshalb sollte man möglichst früh lernen, den eigenen Energiebedarf zu berechnen und im Blick zu behalten.		-1	1	731
985	4	30	10	3985	4024	Ernährung und Bewegung gehören zusammen		-1	1	732
986	4	31	10	0	128	Umweltbewusstes Essen ist nicht nur eine Frage natürlicher Produktionsbedingungen und Kontrollmechanismen seitens der Industrie.		-1	1	733
987	4	31	10	129	158	Es ist auch ein Bildungsthema		-1	1	734
988	4	33	10	0	264	In den letzten Jahrzehnten hat sich im Zuge von Globalisierung und Technisierung das Lebensmittelangebot von einer saisonabhängigen regionalen Vielfalt dahingehend verändert, dass Lebensmittel aller Art zu jeder Jahreszeit durch Importe aus Übersee verfügbar sind.		-1	1	735
989	4	33	10	880	1013	Besonders Kinder brauchen eine gesunde und ausgewogene Ernährung, um sich optimal entwickeln zu können und um leistungsfähig zu sein.		-1	1	736
990	4	33	10	1014	1150	Daher ist es wichtig, dass sie frühzeitig Gelegenheiten bekommen, ein genussvolles und ausgewogenes Ess- und Trinkverhalten zu erlernen.		-1	1	737
991	4	33	10	1151	1238	Darüber hinaus kommt der Ernährungs- und Verbraucherbildung eine zentrale Bedeutung zu.		-1	1	738
992	4	33	10	2274	2508	Gemeinsam mit der Landesarbeitsgemeinschaft für Jugendzahnpflege in Hessen (LAGH) wurde das Konzept des Zuckerfreien Vormittags entwickelt und erprobt, in den hessischen Kindertagesstätten ist es bereits fast flächendeckend umgesetzt.		-1	1	740
993	4	33	10	2508	2546	 Kalorienfreie, ungesüßte Durstlöscher		2	1	725
994	4	33	10	2573	2640	kauaktives frisches Obst und rohes Gemüse sowie ein herzhaftes Brot		2	1	725
995	4	33	10	2666	2711	sind die Bestandteile des zweiten Frühstücks.		2	1	725
996	4	33	10	2862	3024	Darüber hinaus hat der Verzicht auf zuckerhaltige Getränke und Lebensmittel am Vormittag auch positive Auswirkungen auf die Ernährung der Schülerinnen und Schüler		3	1	726
997	4	33	10	3045	3073	und die Ernährungserziehung.		3	1	726
999	4	34	10	1453	1592	lassen sich die in unserer Vorstellungswelt verankerten geschlechter-verschiedenen Essgewohnheiten anhand der Grafik "Picknick" überprüfen.		-1	1	741
1000	4	34	10	1593	1692	Der Aspekt "Kinder und Ernährung" fragt, wie Kinder an die Tätigkeit des Essens herangeführt werden		-1	1	742
1001	4	34	10	1827	1982	So wird der Frage nachgegangen, mit welchen Gegenständen und Eigenschaften aus welchen Lebensbereichen für einzelne Lebens- und Genussmittel geworben wird.		-1	1	743
1002	4	35	10	60	133	ein Frühstück alle drei Kriterien erfüllen kann und trotzdem schnell geht		-1	1	744
818	4	23	11	182	274	Studien zeigen, dass der Fast-Food-Konsum bei Jugendlichen - vor allem bei Jungs - ansteigt.		-1	1	606
819	4	23	11	944	1029	Ziel ist es, mit den Schülerinnen und Schülern über Fast Food ins Gespräch zu kommen.		-1	1	607
820	4	23	11	1029	1133	 Der Fokus liegt dabei vor allem auf dem Umgang mit der Thematik in der Mittagspause und im Schulalltag.		-1	1	618
821	4	24	11	6	127	neue innovative Getränke erobern den Markt, sie machen "Trinken" zum Kult oder ermöglichen ein besonderes Konsumerlebnis.		-1	1	629
822	4	24	11	128	234	Das Durstlöschen - eigentlich die klassische Aufgabe von Getränken - tritt dabei meist in den Hintergrund.		-1	1	640
823	4	24	11	1188	1353	Thematisch passt sie sowohl in den Bereich Humanernährung als auch Zahngesundheit, wenn es darum geht, Zuckerquellen in der täglichen Ernährung ausfindig zu machen. 		-1	1	642
824	4	25	11	278	498	„SchmExperten in der Lernküche“ greift das didaktische Konzept des gleichnamigen Unterrichtsmaterials für die Klassen 5 und 6 auf und erweitert es entsprechend der Vorgaben für den Fachunterricht in der 6. bis 8. Klasse.		-1	1	643
825	4	25	11	633	808	 Die Praxis wird mit weiteren, bildungsrelevanten Themen und Inhalten zur Ernährungs- und Verbraucherbildung verknüpft, wie beispielsweise Esskultur, Einkauf und Kennzeichnung		-1	1	644
826	4	25	11	1903	2070	Mit KüchenExperimenten zu jedem Thema erarbeiten sich die Schülerinnen und Schüler den sicheren und sinnvollen Umgang mit den entsprechenden Geräten und Lebensmitteln.		-1	1	645
827	4	26	11	1285	1490	Angesichts der Produktfülle in den Supermärkten ist die Fähigkeit, Lebensmittel anhand der Pflichtangaben zu bewerten, wichtig und die einzige Möglichkeit für den Verbraucher, Werbeaussagen zu überprüfen.\n		-1	1	646
828	4	26	11	0	162	Im Rahmen von Projekten zur Ernährung und Verbraucherbildung können sich die Schülerinnen und Schüler mit den Angaben auf Lebensmitteletiketten auseinandersetzen.		-1	1	608
829	4	27	11	0	97	Gesundes Essen beeinflusst nicht nur die körperliche, sondern auch die mentale Leistungsfähigkeit		-1	1	609
830	4	27	11	190	307	 Diese Erkenntnis wird gerade im Berufsalltag häufig ignoriert - obwohl man gerade dort den ganzen Tag fit sein muss.		-1	1	610
831	4	27	11	1850	1990	 Planen Sie deshalb nach dem Motto "Essen schafft Gemeinschaft" mit Hilfe dieser Unterrichstmaterialien ein gemeinsames gesundes Frühstück. 		-1	1	611
832	4	27	11	1739	1850	Dementsprechend ist es sinnvoll, das in der Berufsschule erworbene Wissen unmittelbar in die Praxis umzusetzen.		-1	1	612
834	4	28	11	77	252	Da Ernährungsgewohnheiten bereits im Kindesalter geprägt werden, ist es wichtig, dass Kinder mit Spaß und Freude Obst kennenlernen und sozusagen auf "seinen Geschmack" kommen.		-1	1	613
835	4	28	11	0	76	Zu einer präventiven Gesundheitserziehung gehört eine ausgewogene Ernährung.		-1	1	614
836	4	28	11	1095	1170	Über seine gesundheitsfördernde Wirkung wissen Kindern dagegen meist wenig.		-1	1	615
837	4	28	11	1262	1439	Die Kinder lernen unterschiedliche Apfelsorten kennen, erfahren den Apfel als vielseitiges Lebensmittel und entwickeln ein Bewusstsein für seine gesundheitsförderliche Wirkung. 		-1	1	616
