ID	TOPIC_ID	DOC_ID	USER_ID	POSITION_START	POSITION_END	TEXT	SOURCE	LINK_GROUP	COLOR	NUGGET_ID
1972	9	66	10	9365	9418	Die erste betrifft die Lesequantität oder -intensität		-1	1	1510
1973	9	66	10	9473	9522	die zweite betrifft die Lesestoffe und Leseweisen		-1	1	1511
1974	9	66	10	9591	9645	die dritte schließlich die Lesefreude oder Leseneigung		-1	1	1512
1975	9	66	10	9822	9940	Darüber hinaus dürfen wir als gesicherten Befund ansehen, dass diese Unterschiede bereits am Ende des Grundschulalters		12	1	1424
1976	9	66	10	9967	9992	deutlich ausgeprägt sind.		12	1	1424
1977	9	66	10	11533	11596	ein erster "Leseknick" bereits nach der zweiten Klasse einsetzt		-1	1	1513
1978	9	66	10	11760	11825	Ein wichtiger Indikator dafür ist der "Spaß am Deutschunterricht"		-1	1	1514
1983	9	66	10	13091	13201	Hatten die Kinder für ihre freien Lesestunden in der Schule allerdings neben Büchern auch elektronische Medien	Andrea Bertschi-Kaufmann	15	1	1425
1984	9	66	10	13212	13223	zur Auswahl		15	1	1425
1985	9	66	10	13277	13356	dann waren die geschlechtsspezifischen Differenzen deutlich geringer ausgeprägt		15	1	1425
1986	9	66	10	13751	13889	Mädchen finden schneller zum Buch, sie nutzen es häufiger und wählen dabei insgesamt früher als die Jungen auch anspruchsvolle Lesestoffe.	Andrea Bertschi-Kaufmann	-1	1	1515
1990	9	66	10	14880	15127	1995/1996 wurden im Rahmen des Modellversuches "Öffentliche Bibliothek und Schule" der Bertelsmann-Stiftung 4461 Schülerinnen und Schüler zwischen 6 und 16 Jahren (d.h. von der 1. bis zur 10. Klasse) in 6 deutschen Städten mittlerer Größe befragt.		-1	1	1516
1991	9	66	10	15369	15442	Der für diese Studie entwickelte "Leseindex" als Maß für Lesegewohnheiten		17	1	1426
1992	9	66	10	15545	15627	zeigt eine kontinuierliche Abnahme der Leseintensität in den höheren Altersgruppen		17	1	1426
1993	9	66	10	15681	15742	Der erste Einbruch erfolgt zwischen dem 8. und 10. Lebensjahr		-1	1	1517
1994	9	66	10	15822	15897	der zweite und vielleicht gravierendere zwischen dem 11. und 13. Lebensjahr		-1	1	1518
1995	9	66	10	17060	17182	Nach Schultypen aufgeschlüsselt zeigt sich, dass besonders die Haupt- und Realschule von dieser Entwicklung betroffen sind	Harmgarth 1997	-1	1	1519
1996	9	66	10	17485	17640	das Geschlecht einerseits und die Bildung andererseits zu einem großen Teil darüber entscheiden, ob gewohnheitsmäßig eher viel oder eher wenig gelesen wird	Harmgarth 1997	-1	1	1520
1998	9	66	10	20902	21076	Aus der lesebiographischen und psychoanalytischen Forschung wissen wir, dass Lesen in der Kindheit und Pubertät vor allem dem Lustgewinn oder der Phantasiebefriedigung dient.		-1	1	1521
1999	9	66	10	21083	21421	Damit eine lebensgeschichtlich stabile Lesemotivation aufgebaut wird, muss das Lesen in der Kindheit, also in dem Zeitraum zwischen 8 und 12/13 Jahren ( nach dem Erwerb der Lesefertigkeit in den ersten beiden Grundschulklassen und vor dem beinahe unvermeidlichen "Leseknick" in der Pubertät), als eine lustgewährende Praxis erlebt werden.		-1	1	1522
2000	9	66	10	21422	21567	Heutzutage wird aber das lustorientierte Lesen früherer Generationen von Kindern zunehmend ersetzt durch andere Formen lustvoller Medienrezeption		-1	1	1523
2001	9	66	10	22212	22346	Die Schule verstärkt diesen Trend, statt ihm effektiv entgegenzuwirken, weil sie eine vollkommen unzulängliche Leseförderung betreibt.		-1	1	1524
2002	9	66	10	22920	22999	Eine gezielte Leseförderung für Jungen muss bereits in der Grundschule ansetzen		-1	1	1525
2003	9	66	10	23271	23449	Da gerade für die Jungen der lesefördernde Einfluss des Elternhauses immer geringer wird und die Angebote des Medienmarktes hier immer wirkungsvoller familiale Einflüsse ersetzen		18	1	1427
2004	9	66	10	23514	23670	muss sich die Schule darauf einstellen, dass sie in Zukunft viele Funktionen der primären literarischen Sozialisation gerade für die Jungen übernehmen muss.		18	1	1427
2012	9	68	10	12	85	Das männliche Geschlecht ist in stärkerem Maße von Leseschwäche betroffen		-1	1	1526
2013	9	68	10	1226	1373	Ein deutlicher Unterschied zwischen Jungen und Mädchen zeigte sich besonders bei der Fähigkeit, nicht nur so genannte "nicht-kontinuierliche Texte"		19	1	1428
2014	9	68	10	1468	1561	lesen und verstehen zu können, sondern auch "kontinuierliche Texte", also reine Schrifttexte.		19	1	1428
2015	9	68	10	1802	1868	Auch erreichen Mädchen eine höhere Lesegeschwindigkeit als Jungen.	PISA-Studie	-1	1	1527
2016	9	68	10	1895	2019	je anspruchsvoller die Aufgaben, desto größer der Abstand zwischen Mädchen und Jungen, desto besser schneiden die Mädchen ab	PISA-Studie	-1	1	1528
2017	9	68	10	2023	2068	Pubertärer Leseknick betrifft mehr die Jungen		-1	1	1529
2018	9	68	10	2069	2167	Auch im Kindergartenalter scheinen sich die Jungs schon eher von Bilderbüchern angezogen zu fühlen		-1	1	1530
2021	9	68	10	2227	2345	Die Intensität, mit der sich Jungs wie Mädchen mit Büchern beschäftigen, ist bis in die Grundschuljahre hinein gleich.		-1	1	1531
2022	9	68	10	2346	2389	Erst dann lesen Jungen weniger als Mädchen.		-1	1	1532
2023	9	68	10	2397	2456	bei Zeitschriften besteht diese Geschlechterdifferenz nicht		-1	1	1533
2024	9	68	10	2519	2588	Das Interesse an Geschriebenen lässt in bestimmten Lebensphasen nach.		-1	1	1534
2025	9	68	10	2630	2704	Das erste Mal lässt das Interesse am Lesen im Alter zwischen acht und neun		20	1	1429
2026	9	68	10	2752	2756	nach		20	1	1429
2027	9	68	10	3389	3450	Bei Eintritt in die Pubertät erfolgt ein zweiter "Leseknick".		-1	1	1535
2030	9	68	10	3708	3892	Wurde allerdings in den lesefreudigeren Lebensphasen das Lesen mit Genuss in Verbindung gebracht, können Heranwachsende von derartig einschneidender Leseunlust während des "Leseknicks"		21	1	1430
2031	9	68	10	3936	3975	zumindest weniger stark betroffen sein.		21	1	1430
2032	9	68	10	4290	4329	nur wer gerne liest, liest viel und gut		-1	1	1536
2033	9	68	10	4331	4577	Da Mädchen offensichtlich zu erzählender Literatur einen besseren Zugang haben als Jungen und der Deutschunterricht auf erzählende Literatur ausgerichtet ist, erhalten Jungen wie Paul zu wenig Anregungen für Bücher, die sie interessieren könnten.		-1	1	1537
2034	9	68	10	4584	4779	vermuten Experten der Leseforschung, dass dies auch in Verbindung steht mit den in der verfügbaren Literatur angebotenen Themen und dem für Jungen mangelnden Identifikationspotenzial der Figuren.		-1	1	1538
2036	9	68	10	4787	4907	wird die Tätigkeit des Lesens an sich und des Lesens von Romanen insbesondere von vielen Jungen als "weiblich" empfunden		-1	1	1539
2037	9	68	10	6537	6584	Eine Ersetzung oder Verdrängung von Printmedien	Prof. Christine Garbe	22	1	1431
2038	9	68	10	6611	6759	durch Bildschirmmedien findet vor allem bei Jungen statt, während die Mädchen die neuen Medien eher ergänzend zu den 'alten' (Print-) Medien nutzen.		22	1	1431
2039	9	68	10	7406	7496	Lesen Jungen vermehrt Sachbücher, sind sie sehr wohl in einem bestimmten Bereich gebildet.	Leseexpertin Müller-Walde	-1	1	1540
2040	9	68	10	7497	7544	Lesen sie allerdings "nur" Sachbücher, sind sie	Leseexpertin Müller-Walde	23	1	1432
2041	9	68	10	7580	7706	nicht in der Lage, im Rahmen dieser Aktivität auch Fähigkeiten wie soziale Kompetenz oder Kommunikationsfähigkeit auszuprägen.		23	1	1432
2043	9	68	10	9470	9633	Hier gilt "gut ist, was gewünscht wird" und nicht, was Mütter und Lehrerinnen für "gut" erachten, was aber viel zu oft an der Welt von Jungen wie Paul vorbeiläuft.		-1	1	1541
2044	9	69	10	194	465	Eine wichtige wissenschaftliche Erkenntnis der vergangenen Jahre jedoch war, dass "die Hauptursache für die Schwierigkeiten beim Lesen- und Rechtschreibenlernen in einem subtilen Sprachdefizit liegt, genauer: in einem Defizit der phonologischen Verarbeitung zu sehen ist"	Salzburger Sprachheilpädagogin Karin Landerl	-1	1	1542
2047	9	69	10	706	960	In der Studie "Kognitive Defizite bei Leseschwäche" geht Karin Landerl von der Universität Salzburg der Frage nach, inwiefern und in welchen Bereichen der verbalen und nonverbalen kognitiven Verarbeitung Kinder mit schwacher Lesefähigkeit Defizite haben.		-1	1	1543
2048	9	69	10	1650	1794	Neben diesen verbalen Faktoren als Ursache für Leseschwäche untersuchen Wissenschaftler auch den möglichen Zusammenhang mit visuellen Defiziten.		-1	1	1436
2049	9	69	10	3025	3232	Auch wenn viele Kindertagesstätten und Grundschulen die Wichtigkeit, das Gehör beim Lesenlernen mit einzubeziehen erkannt haben, mangelt es bei vielen Grundschülerinnen und Grundschülern am "Hinhörenkönnen".		-1	1	1437
2051	9	69	10	3233	3451	Der Würzburger Professor für pädagogische Psychologie Wolfgang Schneider hat aus diesem Grund unter dem Titel "Hören, lauschen, lernen" ein Programm zur Förderung der so genannten phonologischen Bewusstheit entwickelt.		-1	1	1438
2053	9	69	10	3452	3497	Es soll Lese-Rechtschreib-Schwächen vorbeugen		-1	1	1439
2055	9	69	10	3593	3703	Unter phonologischer Bewusstheit wird allgemein der Einblick der Kinder in die gesprochene Sprache verstanden.		-1	1	1440
2057	9	69	10	3846	3951	Im Schulalter zeigt sie sich in der Fähigkeit, vorgesprochene Wörter in ihre Lautbestandteile zu zerlegen		-1	1	1441
2058	9	69	10	4012	4045	Genau dies müssen die Kinder üben		-1	1	1442
2059	9	69	10	4355	4421	Auch Reime oder Reimspiele sind für die Sprachentwicklung wichtig.		-1	1	1443
2060	9	69	10	4423	4481	Mit Hörbüchern das Ohr trainieren Hörbücher sind im Trend.		-1	1	1444
2061	9	69	10	4772	4851	Vorlesen ist mit dem Hören von Hörspielen und Hörbüchern auch nicht zu ersetzen		-1	1	1445
2063	9	70	10	455	565	Wir wollen zum einem die schon bestehenden Projekte der Stiftung Lesen noch stärker wissenschaftlich begleiten	Auch der geschlechtsspezifische Aspekt soll weiter betont werden.	-1	1	1446
2064	9	70	10	630	714	Zum anderen möchte sich die Stiftung Lesen auch im Wissenschaftsbereich profilieren.	Prof. Dr. Stefan Aufenanger	-1	1	1447
2066	9	70	10	1021	1086	Auch der geschlechtsspezifische Aspekt soll weiter betont werden.	Prof. Dr. Stefan Aufenanger	-1	1	1448
2067	9	70	10	1287	1385	Laut PISA und anderer Studien steht es um die Lesekompetenz unserer Jugendlichen nicht zum Besten.	Online-Redaktion	-1	1	1449
2068	9	70	10	1431	1487	Wäre es sinnvoll, eine Nichtleserforschung zu betreiben?	Online-Redaktion	-1	1	1450
2069	9	70	10	2132	2245	In der Stiftung Lesen haben wir uns dieses Problem als einen Forschungsschwerpunkt der nächsten Jahre ausgewählt.	Aufenanger	-1	1	1451
2070	9	70	10	2363	2457	Der Trendbericht Kinder- und Jugendbuch 2006 hat gezeigt: Es gibt zu wenige Bücher für Jungen.	Online-Redaktion	-1	1	1452
2073	9	70	10	2799	3000	Zwei Dinge erscheinen bei diesem Aspekt notwendig: Zum einen ist eine Öffnung der überwiegend weiblichen Lehrpersonen in Grundschulen, Bibliotheken und im Buchhandel für die Buchpräferenzen von Jungens	Aufenanger	24	1	1433
2074	9	70	10	3093	3102	notwendig		24	1	1433
2076	9	70	10	3104	3161	Zum anderen sollte man die Jungen auch über andere Medien	Aufenanger	25	1	1434
2077	9	70	10	3227	3238	ansprechen.		25	1	1434
2078	9	70	10	3784	3888	Auch viele der neuen Medien verlangen Lesefertigkeiten, sonst könnten sie nicht sinnvoll genutzt werden.	Aufenanger	-1	1	1453
2081	9	70	10	3959	3962	Die	Aufenanger	26	1	1435
2082	9	70	10	4015	4135	Unterscheidung von guten und schlechten Medien hilft meines Erachtens wenig, Kinder und Jugendliche zum Lesen zu führen.		26	1	1435
2083	9	70	10	4136	4230	Hier dürften anspruchsvolle, aber zugleich kind- bzw. jugendorientierte Inhalte sinnvoll sein.	Aufenanger	-1	1	1454
2084	9	70	10	5258	5323	Den Eltern kommt in der Medienerziehung eine prominente Rolle zu.	Aufenanger	-1	1	1455
2085	9	70	10	5573	5624	Jeder Zugang sollte als Möglichkeit gesehen werden.	Aufenanger	-1	1	1456
2086	9	70	10	6303	6448	Gegen Computer in Kindertagesstätten oder in jungen Familien ist aus meiner Sicht nichts einzuwenden, wenn bestimmte Bedingungen gewahrt werden. 	Aufenanger	-1	1	1457
2087	9	70	10	7129	7235	Die Stiftung Lesen hat vielfältige Projekte, die auf ganz unterschiedlichen Wegen Leseförderung betreiben.	Aufenanger	-1	1	1458
2090	9	71	10	12	80	Das "Lesenetz Baden-Württemberg" entwickelt neue Kooperationsformen.		-1	1	1459
2091	9	71	10	566	618	Sein Ziel: Kinder zu langfristigen Lesern zu machen.		-1	1	1460
2092	9	71	10	1401	1588	Durch individuelle Patenschaften zwischen Lehramtsstudierenden und Schülerinnen und Schülern sollen mehr Nachhaltigkeit erzielt und eine stärkere Bindung an die Bibliothek erreicht werden		-1	1	1461
2093	9	71	10	1658	1823	Zugleich wird den Lehramtsstudierenden als zukünftigen Lehrerinnen und Lehrern die Rolle öffentlicher Bibliotheken für die Lesesozialisation stärker bewusst gemacht.		-1	1	1462
2094	9	71	10	2058	2204	Im Mittelpunkt standen zum einen eine Führung in der Bibliothek und zum anderen mehrere Treffen der Patenkinder mit ihren Paten in der Bibliothek.		-1	1	1463
2097	9	71	10	3017	3240	Die Studierenden trafen sich in der Regel drei Mal mit ihren Patenkindern in der Bibliothek, suchten mit ihnen Bücher aus, führten Lesegespräche über ihre (Lese-) Interessen und -gewohnheiten und über die gelesenen Bücher. 		-1	1	1464
2098	9	71	10	4562	4744	Sicher ist ein gesteigertes Interesse an der Bibliothek, die Steigerung der Besuchsfrequenz und der Ausleihzahlen während der Projektphase untypisch hoch und flacht danach wieder ab.		-1	1	1465
2099	9	71	10	4745	4895	Wenn aber andere Institutionen wie Familie und Schule die Verbindung weiter aktiv unterstützen, kann eine anhaltende Nutzung leichter erreicht werden.		-1	1	1466
2101	9	71	10	5116	5201	Durch die beschriebenen Patenschaften konnte sich die Perspektive deutlich verändern.		-1	1	1467
2102	9	72	10	516	650	Wer in der Schule lese- und rechtschreibschwach ist und bleibt, wird nach der Schulentlassung zu den funktionalen Analphabeten gehören	Iris Füssenich, Professorin für Sprachbehindertenpädagogik der Pädagogischen Hochschule Ludwigsburg.	-1	1	1468
2104	9	72	10	1259	1333	Für Analphabetismus gibt es eine Vielzahl an Definitionen und Abstufungen.		-1	1	1469
2105	9	72	10	1334	1450	So spricht man von einem primären oder totalen Analphabetismus, wenn Menschen nie lesen und schreiben gelernt haben.		-1	1	1470
2106	9	72	10	1564	1649	Seit den 70er Jahren ist darüber hinaus auch vom sekundären Analphabetismus die Rede.		-1	1	1471
2107	9	72	10	1650	1761	Das bedeutet: Die Fähigkeiten zum Lesen und Schreiben waren zwar einmal vorhanden, wurden aber wieder verlernt.		-1	1	1472
2108	9	72	10	1899	1990	Von Semianalphabetismus spricht man, wenn Menschen zwar lesen, aber nicht schreiben können.		-1	1	1473
2109	9	72	10	1992	2102	Die Haupterscheinungsform des Analphabetismus in Deutschland ist allerdings der "funktionale Analphabetismus".		-1	1	1474
2110	9	72	10	2103	2203	Von ihm betroffen sind Menschen, die trotz langjährigem Schulbesuch kaum lesen und schreiben können.		-1	1	1475
2112	9	72	10	2645	2832	Manche funktionalen Analphabeten beherrschen zwar die Grundzüge des Lesens und Schreibens, erreichen jedoch längst nicht die gesellschaftlichen Mindestanforderungen an die Schriftsprache.		-1	1	1476
2113	9	72	10	3125	3306	Oft bedeutet dies für die betroffenen Menschen, dass sie sozial ausgegrenzt werden und ihren Arbeitsplatz verlieren beziehungsweise erst gar keinen Zugang zum Arbeitsmarkt erhalten.		-1	1	1477
2114	9	72	10	3308	3355	Typische Lebensläufe sind oft Teufelskreisläufe		-1	1	1478
2115	9	72	10	3816	3912	sind besonders Angehörige so genannter sozial schwacher Schichten vom Analphabetismus betroffen.		-1	1	1479
2116	9	72	10	5305	5556	In den meisten Fällen handelt es sich um Kinder, deren Eltern selbst Analphabeten sind beziehungsweise eine negative Lerngeschichte hinter sich haben und die aufgrund ihrer eigenen Schwierigkeiten keine solidarische Stütze für ihre Kinder sein können"	Füssenich	-1	1	1480
2117	9	72	10	5804	5885	Bereits in den ersten Schuljahren entwickeln die betroffenen Kinder Lernblockaden		-1	1	1481
2118	9	72	10	5887	5988	Diese zeigen sich in Verhaltensauffälligkeiten, Motivationsproblemen und einem "Null-Bock-Verhalten".		-1	1	1482
2120	9	72	10	6260	6367	Die schulischen Angebote und die individuelle Voraussetzungen sind nicht ausreichend aufeinander abgestimmt		-1	1	1483
2121	9	72	10	6580	6701	Viele Jugendliche mit erheblichen Defiziten in den Kulturtechniken Rechnen und Lesen verlassen ohne Abschluss die Schule.		-1	1	1484
2122	9	72	10	7084	7143	Schulabbrecher sind auf dem Ausbildungsmarkt oft chancenlos		-1	1	1485
2123	9	72	10	7394	7514	Die Angst vor Entdeckung und sozialer Stigmatisierung lässt Analphabeten häufig zu Außenseitern der Gesellschaft werden.		-1	1	1486
2124	9	72	10	8069	8290	Die Teilnahme am politischen und öffentlichen Leben, die umfassende Entwicklung der eigenen Person, der Wissenserwerb und die Kenntnis von anderen Welten sind durch die großen Defizite im Lesen und Schreiben kaum möglich.		-1	1	1487
2125	9	72	10	8290	8365	 Die Schrift ist ein Mittel der Strukturierung der Sprache und des Denkens.		-1	1	1488
2126	9	72	10	8366	8460	So fehlt Analphabeten oft jenes organisierte Denken, das nötig ist, um das "Lernen zu lernen".		-1	1	1489
2127	9	72	10	9712	9805	Und als Vorbeugung gilt: Kinder im Vorschulalter in ihrer sprachlichen Kommunikation fördern.		-1	1	1490
2130	9	73	10	228	257	Dafür gibt es viele Ursachen.	Prof. Dr. Christine Garbe	-1	1	1544
2131	9	73	10	258	329	Das ist ein komplexes Phänomen, das man nicht monokausal erklären kann.	Christine Garbe	-1	1	1545
2132	9	73	10	330	639	Manche Gehirnforscher und Evolutionsbiologen behaupten zum Beispiel, dass ´männliche´ und ´weibliche´ Gehirne verschieden organisiert sind, bei weiblichen Gehirnen die Sprachkompetenz, Sozialkompetenz und Emotionalität stärker ausgeprägt seien und darum die Mädchen besser lesen (und schreiben) als die Jungen	Christine Garbe	-1	1	1546
2133	9	73	10	641	812	Eine solche monokausale Erklärung greift aber in jedem Fall zu kurz, auch wenn man die Ansicht teilt, dass genetische (anlagebedingte) Faktoren eine Rolle spielen könnten.	Christine Garbe	-1	1	1547
2134	9	73	10	813	970	Die PISA-Studie 2000 hat festgestellt, dass die Jungen in punkto Lesekompetenz in allen untersuchten Ländern deutlich schlechter abschneiden als die Mädchen.	Christine Garbe	-1	1	1548
2135	9	73	10	971	1130	PISA hat die Daten aber noch genauer ausgewertet und festgestellt, dass die Jungen, die viel und gern lesen, genau so gut lesen wie die entsprechenden Mädchen!	Christine Garbe	-1	1	1549
2136	9	73	10	1131	1314	Das spricht also gegen genetische Erklärungen; es spricht dafür, dass die Kompetenzunterschiede vor allem daher rühren, dass die Jungen weniger und weniger gern lesen als die Mädchen.	Christine Garbe	-1	1	1550
2137	9	73	10	1454	1677	Hierfür kommen meines Erachtens vor allem zwei Gründe in Betracht: Erstens liegt die gesamte literale und literarische Frühförderung von Kindern bis zum 10. oder 11. Lebensjahr heutzutage weitgehend in den Händen von Frauen	Christine Garbe	-1	1	1551
2138	9	73	10	2464	2726	Zugleich lässt sich auch in der zeitgenössischen Kinder- und Jugendliteratur, mindestens in derjenigen, die von Müttern, Erzieherinnen und Lehrerinnen an die Kinder herangetragen wird, wenig attraktiver Lesestoff für Jungen entdecken. Das potenziert das Problem.	Christine Garbe	-1	1	1552
2139	9	73	10	2728	2776	Der zweite Grund liegt in der "Medienkonkurrenz"	Christine Garbe	-1	1	1553
2141	9	73	10	3419	3517	Der Bildschirm ersetzt für viele Jungen das Buch, weil er für sie attraktivere Angebote bereithält	Christine Garbe	-1	1	1554
2142	9	73	10	4409	4483	Wir brauchen (vor-)lesende Väter, Erzieher und Lehrer in den Grundschulen!	Christine Garbe	-1	1	1555
2143	9	73	10	4485	4656	Ferner ist wichtig, dass die Schulen insgesamt der Leseförderung einen viel größeren Stellenwert geben als bislang, und zwar in allen Klassenstufen und allen Schulfächern.	Christine Garbe	-1	1	1556
2144	9	73	10	4663	4782	müssen insgesamt die (Lese-)Interessen und Medienpräferenzen von Jungen viel stärker berücksichtigt werden als bislang.	Christine Garbe	-1	1	1557
2145	9	73	10	5087	5146	Man muss heutzutage das Lesen mit anderen Medien verbinden.	Christine Garbe	-1	1	1558
2146	9	73	10	9649	9823	Wir sollten diesbezüglich von den Computerspielen lernen und den Jungen (und natürlich ebenso den Mädchen!) Möglichkeiten anbieten, mit Lesen Erfolgserlebnisse zu generieren.	Christine Garbe	-1	1	1559
1609	9	62	11	721	1021	Mit dem "reziproken Lernen", dem wechselseitigen Lesenlehren und -lernen, bei dem Schülerinnen und Schüler zwischen der Rolle des Lehrenden und der Rolle des Lernenden hin und her wechseln, bietet sich ein Verfahren an, mit dem nicht nur leseschwache Kinder und Jugendliche unterstützt werden können.		-1	1	1143
1610	9	62	11	5641	6000	Das Wissen um so genannte Elaborationsstrategien (also Anreichern, Ergänzen, Klären, Beziehungen herstellen zu eigenen Erfahrungen, Schlussfolgerungen ziehen, Verbindungen zwischen Textteilen und zwischen Text und Wirklichkeit herstellen) und natürlich die Fähigkeit sie anzuwenden, erwies sich in der PISA-Studie als ein wesentlicher Faktor für Lesekompetenz		-1	1	1144
1611	9	62	11	7564	7688	Man kann solche Komponenten des Verstehens als die Chance aufgreifen, beim Lernen mit Texten das Denken beweglich zu machen.		-1	1	1155
1612	9	62	11	8858	9040	Lesen und Verstehen ist Interaktion zwischen den Lesenden und einem Text, bei der es zu einer Wechselwirkung zwischen den Informationen des Textes und unserem Wissen und Denken kommt		-1	1	1166
1613	9	62	11	9500	9601	Eine wichtige steuernde Komponente unserer Bemühungen um den Aufbau von Bedeutungen ist das Leseziel.		-1	1	1177
1614	9	62	11	246	416	Mit der Lesekompetenz greift die PISA-Studie eine kulturelle Schlüsselqualifikation auf, die ein ganzes Bündel an Fähigkeiten, Kenntnissen, Strategien und Techniken meint		-1	1	1188
1615	9	62	11	1684	1880	In der PISA-Studie haben Lehrkräfte nur etwa 11 Prozent der Schülerinnen und Schüler, die bei den Aufgabenlösungen nicht einmal die Kompetenzstufe I erreichten, auch als "schlechte Leser" erkannt.		-1	1	1199
1616	9	63	11	0	202	Seit ihrem Erscheinen Anfang Dezember 2001 hat die sogenannte PISA-Studie 2000 ("Programme for International Student Assessment 2000") eine heftige Debatte in der deutschen Bildungslandschaft ausgelöst.		-1	1	1203
1617	9	63	11	771	919	Deutsche Schüler(innen) müssen sich, was diese Kompetenzbereiche betrifft, im internationalen Vergleich im Durchschnitt mit hinteren Rängen begnügen		-1	1	1204
1618	9	63	11	1593	1662	in der PISA-Studie von einem erweiterten Textbegriff ausgegangen wird		-1	1	1205
1619	9	63	11	6505	6811	Die PISA-Studie unterscheidet zwischen dem Lesen von Sach- und Gebrauchstexten, das der "Wissensanreicherung" dient, und dem Lesen von "Literatur", das "Möglichkeiten der Lebensbewältigung, des ästhetischen Erlebens, der Befriedigung von Unterhaltungsbedürfnissen und der Persönlichkeitsentfaltung" bietet.		-1	1	1145
1621	9	63	11	7402	7601	im Sinn integrativer Medienpädagogik davon aus, dass Lesekompetenz im weiterem Sinne nicht nur den verstehenden Umgang mit schriftsprachlichen Texten, sondern auch mit medialen Texten aller Art meint		-1	1	1146
1622	9	63	11	8849	8955	Deshalb erfordert der Umgang mit Texten auch immer das Lesen und Schreiben als (Re-)Konstruktionsprozesse.		-1	1	1147
1623	9	63	11	12149	12296	drei von PISA unterschiedenen Aspekte der Lesekompetenz - Informationen ermitteln - Textbezogenes Interpretieren - Reflektieren und Bewerten müssen		-1	1	1148
1625	9	64	11	454	539	80 Prozent der Schüler mit Lese- und Rechtschreibschwäche sind männliche Jugendliche.		-1	1	1149
1626	9	64	11	1653	1759	In Mathematik lassen sich Leistungsvorteile für die Jungen feststellen, diese sind jedoch deutlich kleiner		-1	1	1150
1627	9	64	11	3051	3238	Das an Entwicklungen und Geschichten interessiertes Lesen ist eher kontinuierlich und an gesamten Texten orientiert, das an Informationen orientierte Lesen ist eher selektiv und punktuell		-1	1	1151
1628	9	64	11	2755	2855	Wenn Jungen und Männer lesen, dann scheinen sie eher an Fach- und Sachliteratur interessiert zu sein		-1	1	1152
1629	9	64	11	3690	3832	Im Vergleich zu Mädchen bereitet es Jungen deutlich größere Schwierigkeiten, Texte und ihre Merkmale kritisch zu reflektieren und zu bewerten.		-1	1	1153
1630	9	64	11	5376	5508	Allgemein stehen Mädchen den schriftlich dominierten Medium näher und männliche Jugendliche den visuell dominierten Bildschirmmedien		-1	1	1154
1631	9	64	11	2067	2179	Möglicherweise kommt die Auswahl des Lesestoffs daher mehr dem Geschmack von Mädchen entgegen als dem von Jungen		-1	1	1156
1632	9	65	11	12	122	Lesekompetenz beinhaltet grundlegende kognitive Fähigkeiten, die für den Umgang mit allen Medien wichtig sind.		-1	1	1157
1635	9	65	11	4689	4875	Jugendliche werden zunehmend mit Texten im Internet konfrontiert - mit Hypertexten, die in einer Navigationsstruktur verschachtelt und mit Bildern, Zeichen und Animationen versehen sind.		-1	1	1158
1636	9	65	11	5113	5255	Auch deshalb legte die PISA-Studie nahe, das schulische Spektrum an Textsorten konsequenter als bisher durch nicht-lineare Texte zu erweitern.		-1	1	1159
1637	9	65	11	307	453	Schriftsprachlichkeit im Internet erhält ein neues Gesicht und fordert umso mehr die durch das Lesen trainierten kognitiven Übersetzungsleistungen		-1	1	1160
1639	9	66	11	1680	1814	Je anspruchsvoller die Aufgaben, desto größer der Abstand zwischen Mädchen und Jungen, das heißt desto besser schnitten die Mädchen ab		-1	1	1161
1640	9	66	11	516	608	Die größten und konsistentesten Geschlechterunterschiede sind im Bereich Lesen zu beobachten	Petra Stanat und Mareike Kunter	-1	1	1162
1641	9	66	11	2588	2723	Die Unterschiede zwischen Mädchen und Jungen sind besonders groß bei den sog. "kontinuierlichen Texten" , also den reinen Schrifttexten		-1	1	1163
